,Unnamed: 0,id,domain,type,url,content,scraped_at,inserted_at,updated_at,title,authors,keywords,meta_keywords,meta_description,tags,summary
171,171,26616,beforeitsnews.com,fake,http://beforeitsnews.com/survival/2015/06/greece-is-just-the-beginning-again-this-kind-of-carnage-can-happen-all-over-europe-2574788.html,"greece beginning… “ kind carnage happen europe ” headline bitcoin blockchain searches exceed trump ! blockchain stocks next ! article originally published michael snyder economic collapse blog editor ’ note always matter time , since whole european fiasco merely patched last round new powers given european banks ( king ’ horses men ) ’ put back together , ’ stop inevitable existing conditions – greece ticking time bomb things closer disaster ever everyone already knows bad things stand become plays worst , get ready grexit may near future , brexit still possible , another round global financial titanic could works time tell… next great european financial crisis begun greek financial system process totally imploding , rest europe soon follow neither greeks germans willing give , means little chance debt deal going happen end june means likely see major greek debt default potentially even greek exit eurozone point , credit default swaps greek debt risen 456 percent price since beginning year , market priced 75 percent chance greek debt default happen past month , yield two year greek bonds skyrocketed 20 percent 30 percent , greek stock market fallen total 13 percent last three trading days alone financial collapse looks like , greece leave euro , going see kind carnage happen europe officials europe openly speaking need prepare “ state emergency ” negotiations totally collapsed one time , would unthinkable greece leave euro , appears precisely happen unless miracle happens… greece heading state emergency exit euro following collapse talks agree bailout deal , senior eu officials warned last night europe must prepared step otherwise greek society would face unprecedented crisis power blackouts , medicine shortages money pay police , said past , greeks always buckled pressure new greek government elected mandate end austerity , far shown remarkable amount resolve order debt deal happen , one side going blink , point look like greeks… world ’ financial markets facing possibility greece could soon become first country crash europe ’ single currency talks athens eurozone creditors collapsed acrimony days bee final deadline greece unlock €72bn ( £52bn ) bailout funds needs avoid catastrophic debt default greek prime minister , alexis tsipras , accused creditor powers hidden “ political motives ” demands greece make cuts public pension payments return financial aid “ shouldering dignity people , well hopes people europe , ” mr tsipras said defiant statement “ ignore responsibility matter ideological stubbornness democracy ” approach point return , sides preparing endgame greece , members parliament studying happened iceland years ago many believe greek debt default combined nationalization greek banks greek exit euro could set nation back path prosperity fairly rapidly following comes telegraph… radical wing greece ’ syriza party table plans coming days icelandic-style default nationalisation greek banking system , deeming pointless continue talks europe ’ creditor powers syriza sources say measures drafted include capital controls establishment sovereign central bank able stand behind new financial system dual currency might possible theory , structure would incompatible euro membership would imply rapid return drachma confidential plans circulating weekend backing 30 mps aristeri platma ‘ left platm ’ , well hard-line groupings syriza ’ spectrum understood nationalist anel party ruling coalition also willing ce rupture creditors , need meanwhile , desperate attempt get greeks give last moment , greek ’ creditors preparing pull stops order put much financial pressure greece possible… germany ’ suddeutsche zeitung reported creditors drawing ultimatum greeks , threatening cut greek access european payments system cing capital controls country soon weekend plan would lead temporary closure banks , followed rationing cash withdrawals long time , financial world assumed debt deal would eventually happen reality setting mentioned top article , cost insure greek debt risen astounding 456 percent since beginning year… given dramatic stakes , risk greek default gone way one way measure risk looking skyrocketing price insurance policies would pay greek bonds go bust cost insure greek debt one year risk default skyrocketed 456 % since start 2015 , according factset data insurance-like contracts , known credit default swaps , imply 75 % 80 % probability greece defaulting debt , according jigar patel , credit strategist barclays probability greek default soars whopping 95 % five-year cds , patel said “ default looking likely , ” peter boockvar , chief market analyst lindsey group , wrote note clients tuesday recent days , also seen greek stocks greek bonds totally crash following comes cnn… greek stock market plummeted 13 % past three trading days , including 3 % drop tuesday alone bond market , yield greek two-year debt skyrocketed 302 % month ago , yield 20 % yields rise bond prices fall course greek debt default greece leave euro , ’ greece pays price written previously , tens trillions dollars derivatives directly tied currency exchange rates 505 trillion dollars derivatives directly tied interest rates “ grexit ” would cause euro drop like rock interest rates continent would start go crazy financial chaos “ grexit ” would cause underestimated signs europe ’ biggest banks already verge collapse example , consider going biggest bank germany co-ceos deutsche bank recently resigned , increasingly looking could soon become europe ’ version lehman brothers following summary recent troubles deutsche bank comes article posted notquant… ’ re-cap ’ happened deutsche bank past 15 months april 2014 , deutsche bank ced raise additional 15 billion tier 1 capital support ’ capital structure ? , deutsche bank ced raise additional 15 billion tier 1 capital support ’ capital structure ? 1 month later may 2014 , scramble liquidity continued db announced selling 8 billion euros worth stock – 30 % discount ? move raised eyebrows across financial media calm outward image deutsche bank seem reflect rushed efts raise liquidity something decidedly rotten behind curtain may 2014 , scramble liquidity continued db announced selling 8 billion euros worth stock – 30 % discount ? move raised eyebrows across financial media calm outward image deutsche bank seem reflect rushed efts raise liquidity something decidedly rotten behind curtain fast warding march year deutsche bank fails banking industry ’ “ stress tests ” given stern warning shore ’ capital structure deutsche bank fails banking industry ’ “ stress tests ” given stern warning shore ’ capital structure april , deutsche bank confirms ’ agreement joint settlement us uk regarding manipulation libor bank saddled massive $ 21 billion payment doj ( still , small fraction winnings crime ) deutsche bank confirms ’ agreement joint settlement us uk regarding manipulation libor bank saddled massive $ 21 billion payment doj ( still , small fraction winnings crime ) may , one deutsche bank ’ ceos , anshu jain given enormous amount new authority board directors guess “ crisis move ” times crisis power executive often increased one deutsche bank ’ ceos , anshu jain given enormous amount new authority board directors guess “ crisis move ” times crisis power executive often increased june 5 greece misses ’ payment imf risk default across ’ debt considered acute massive implications deutsche bank greece misses ’ payment imf risk default across ’ debt considered acute massive implications deutsche bank june 6/7 ( saturday/sunday , immediately following greece ’ missed payment imf ) deutsche bank ’ two ceo ’ announce surprise departure company ( one month jain given new expanded powers ) anshu jain step first end june jürgen fitschen step next may ( saturday/sunday , immediately following greece ’ missed payment imf ) deutsche bank ’ two ceo ’ announce surprise departure company ( one month jain given new expanded powers ) anshu jain step first end june jürgen fitschen step next may june 9 sp lowers rating deutsche bank bbb+ three notches “ junk ” ( incidentally , bbb+ even lower lehman ’ downgrade – preceded ’ collapse 3 months ) ’ bad ? ’ know ’ permitted know moves healthy company long time , warning major financial crisis coming europe , long time authorities europe able successfully kick road looks like reached end road , day reckoning finally nobody quite sure going happen next , almost everyone agrees ’ going pretty better buckle , looks like wild ride enter second half year michael snyder graduate university florida law school worked attorney heart washington dc number years today , michael best known work publisher economic collapse blog american dream want know things america going look like years read new book beginning end article contributed shtf plan visit wwwshtfplancom alternative news , commentary preparedness info source http//wwwshtfplancom/headline-news/greece-is-just-the-beginning-again-this-kind-of-carnage-can-happen-all-over-europe_06202015",2018-01-25 16:17:44.789555,2018-02-02 01:19:41.756632,2018-02-02 01:19:41.756664,Greece is Just the Beginning… Again: “This Kind of Carnage Can Happen All Over Europe”,,,[''],,,
172,172,26617,beforeitsnews.com,fake,http://beforeitsnews.com/survival/2015/06/guns-of-hollywood-058-mission-impossible-2574790.html,easily understand difference day christ day lord end times,2018-01-25 16:17:44.789555,2018-02-02 01:19:41.756632,2018-02-02 01:19:41.756664,Guns of Hollywood 058 – Mission Impossible,Firearms Radio Network,,[''],,,
173,173,26829,beforeitsnews.com,fake,http://beforeitsnews.com/survival/2013/11/cowboy-mounted-shooting-association-joins-north-american-international-livestock-expo-2497300.html,"cowboy mounted shooting association joins north american international livestock expo % readers think story fact add two cents headline bitcoin blockchain searches exceed trump ! blockchain stocks next ! expo louisville , ky november 14-16 , 2013 north american international livestock expo cowboy mounted shooting association louisville , ky -- ( ammolandcom ) - cowboy mounted shooting association ( cmsa ) pleased announce participation north american international livestock expo held louisville , ky guaranteed $ 10,000 payout double finals 6 times points awarded 50 % class payback competition held follows thursday 11/14 800 am- 400 pm coliseum main match stages 1 , 2 , 3 wranglers , class 1 , 2 , 3 , 4 , 5 , 6 aqha class run end stage immediately following stage 3 outdoor arena cimarron shotgun taylor ’ company rifle stage one cimarron eliminator second elimination - top 20 men , top 20 ladies limited ( class 1 , 2 3 ) - top 20 men , top 20 ladies express ( class 4 , 5 6 ) friday 11/15 noon coliseum double incentive finals ( 20 minute break divisions ) - top 10 limited ladies - top 10 limited men - top 10 express ladies - top 10 express men - top 10 open ladies - top 10 open men saturday 11/16 100 pm coliseum starline showcase ( 20 minute break divisions ) cimarron limited eliminator - top 10 limited ladies - top 10 limited men - cimarron shotgun stage 2 - taylor ’ company rifle stage 2 cimarron open eliminator - top 10 open ladies - top 10 open men visit cmsa website wwwcowboymountedshootingcom complete results total times competitor following conclusion event cmsa cowboy mounted shooting association ( cmsa ) one fastest growing equestrian sports organizations nation mounted contestants compete fast-action timed event using two 45 caliber single-action revolvers loaded five rounds specially prepared blank ammunition family-friendly cmsa offers multiple levels competition men , women children , novice seasoned professional organized 1994 , cmsa boasts 102 local clubs four nations , representing 13,000 members sanctions 600 events year , including seven events highest level , championship series , pays $ 700,000 prize money annually subscribe advertise official cmsa magazine , rundown , contact tammyjcoffman @ gmailcom request media kit inmation cmsa , visit cmsaeventscom , follow us facebook facebookcom/cowboymountedshootingassociation naile 40th annual naile produced commonwealth kentucky kentucky exposition center louisville , kentucky direction kentucky state fair board expo ’ two-week run november 9 22 , facility ’ entire 1,200,000 square feet climate-controlled exhibit space used 200,000 visitors exhibitors attend event annually purebred livestock exhibitors animals come nearly every state , 10 livestock divisions giant expo inmation available naile website wwwlivestockexpoorg source http//wwwammolandcom/2013/11/cowboy-mounted-shooting-association-joins-north-american-international-livestock-expo/",2018-01-25 16:17:44.789555,2018-02-02 01:19:41.756632,2018-02-02 01:19:41.756664,Cowboy Mounted Shooting Association Joins North American International Livestock Expo,,,[''],,,
174,174,26929,beforeitsnews.com,fake,http://beforeitsnews.com/press-releases/2017/09/benzalkonium-chloride-industry-2017-global-market-trend-profit-growth-and-key-manufacturers-analysis-report-3195022.html,"benzalkonium chloride industry 2017 global market trend , profit , growth key manufacturers analysis report % readers think story fact add two cents headline bitcoin blockchain searches exceed trump ! blockchain stocks next ! global benzalkonium chloride industry report 2017 professional indepth study current state benzalkonium chloride market inquire inmation @ http//wwwdeepresearchreportscom/contacts/inquire-bee-buyphp ? name=457436 report provides basic overview industry including definitions , classifications , applications industry chain structure benzalkonium chloride market analysis provided international markets including development trends , competitive landscape analysis , key regions development status complete report benzalkonium chloride market spread across 106 pages , profiling companies supported tables figures ; access report @ http//wwwdeepresearchreportscom/contacts/inquiryphp ? name=457436 analysis benzalkonium chloride industry key manufacturers united states lime minerals , sudbury lime , renegade gas , gilmour company , austin white lime company , lhoist north america development policies plans discussed well manufacturing processes cost structures also analyzed report also states import/export consumption , supply demand figures , cost , price , revenue gross margins report focuses global major leading benzalkonium chloride market players providing inmation company profiles , product picture specification , capacity , production , price , cost , revenue contact inmation upstream raw materials equipment downstream demand analysis also carried benzalkonium chloride industry development trends marketing channels analyzed finally feasibility new investment projects assessed overall research conclusions offered list tables figures report provides key statistics state industry valuable source guidance direction companies individuals interested market",2018-01-25 16:17:44.789555,2018-02-02 01:19:41.756632,2018-02-02 01:19:41.756664,"Benzalkonium Chloride Industry 2017: Global Market Trend, Profit, Growth and Key Manufacturers Analysis Report",,,[''],,,
175,175,27128,beforeitsnews.com,fake,http://beforeitsnews.com/market-research-reports/2017/11/trends-global-connected-enterprise-market-2017-analysis-by-growth-platform-solution-service-vertical-applications-drivers-opportunities-and-challenges-136853.html,"trends global connected enterprise market 2017 analysis growth , platm , solution , service , vertical , applications , drivers , opportunities challenges % readers think story fact add two cents headline bitcoin blockchain searches exceed trump ! blockchain stocks next ! gobal connected enterprise market offers professional in-depth study current state global embalming workstations industry along geography ; platm ; solution ; service ; vertical – industry trends ecast 2024 global connected enterprise market accounted usd 1102 billion 2016 growing cagr 324 % ecast period 2017 2024 upcoming market report contains data historic year 2014 , 2015 , base year calculation 2016 ecast period 2017 2024 connected enterprise helps enabling visibility , faster decision making new collaboration widely applicable banking , financial services , insurance , telecommunications , retail ecommerce , energy utilities , media entertainment , others increased need automation cloud computing across industries may act major driver growth connected enterprise market side , high cost deployment lack unim iot standards may hamper market get free sample report “ global connected enterprise market ” report visit @ http//databridgemarketresearchcom/request-a-sample/ ? dbmr=global-connected-enterprise-market major market competitors major players global connected enterprise market rockwell automation , inc , cisco systems , inc , ptc , microsoft corporation , ibm corporation , bosch limited , honeywell international inc , general electric , accelerite , verizon , others market segmentation basis platm – device management , connectivity management , application enablement platm basis geography , global connected enterprise market report covers data points 28 countries across multiple geographies north america , south america , europe , asia-pacific , middle east africa basis solution – real-time collaboration , enterprise infrastructure management , streaming analytics , security solution , data management , remote monitoring system , network management , mobile workce management , customer experience management , asset permance management basis service – managed service professional service professional sub segmented consulting services , integration deployment services , support maintenance services browse full detailed toc , sample , inquiry , expert global connected enterprise market visit @ http//databridgemarketresearchcom/reports/global-connected-enterprise-market/ basis application – banking , financial services , insurance , telecommunications , retail ecommerce , energy utilities , media entertainment , others major market drivers restraints increasing need automation cloud computing across industries realized potential voluminous data better processes operations reduced cost maintenance account smart connected devices steep surge technological advancements big data , cloud , mobile devices high cost deployment lack unim iot standards technology skills company share analysis report global connected enterprise market include detailed vendor level analysis market shares 2016 global , north america , europe , asia pacific , middle east africa south america specifically also impact development analysis key vendors registered market factored basis vendor positioning grid analysis measures vendors strengths opportunities present market challenges , measure providers ability identify satisfy present market needs , map providers market vision current upcoming market dynamics among others report also measures technology life line curve market time line analyze affective investments inquiry bee buying @ http//databridgemarketresearchcom/inquire-bee-buying/ ? dbmr=global-connected-enterprise-market related report global image recognition market – industry trends ecast 2024 global image recognition market , geography ; technology ( code recognition , digital image processing , facial recognition , object recognition , pattern recognition , optical character recognition ) ; component ( hardware , software , services ) ; application ; deployment type ; industry – industry trends ecast 2024 access report http//databridgemarketresearchcom/reports/global-image-recognition-market/ data bridge market research data bridge market research set th unconventional neoteric market research consulting firm unparalleled level resilience integrated approaches determined unearth best market opportunities foster efficient inmation business thrive market data bridge endeavors provide appropriate solutions complex business challenges initiates eftless decision-making process contact vishal dixit data bridge market research tel +1-888-387-2818 email sales @ databridgemarketresearchcom investor investors @ databridgemarketresearchcom visit blog http//databridgemarketresearchcom/blog/ follow us linkedin https//wwwlinkedincom/company/data-bridge-market-research",2018-01-25 16:17:44.789555,2018-02-02 01:19:41.756632,2018-02-02 01:19:41.756664,"Trends Global Connected Enterprise Market 2017 Analysis by Growth, Platform, Solution, Service, Vertical, Applications, Drivers, Opportunities and Challenges",Data Bridge Market Research,,[''],,,
176,176,27272,naturalnews.com,junksci,https://www.naturalnews.com/055405_opioids_Big_Pharma_addiction_epidemic.html,"( naturalnews ) thought big pharma could n't sink lower , wrong recent report led theand center public integrity , revealed manufacturers opioid drugs , oxycontin , vicodin fentanyl , spent whopping $ 880 million campaign contributions lobbying efts huge amount money spent pushing state efts restrict amount prescription opioid drugs floating around unaware , united states currently experiencing opioid epidemic – one particularly profitable big pharma oxycontin one prolific drugs prescription opioid craze , one addictivewrites recent expose theuncovered fact purdue pharma knowingly lied product despite marketed -hour pill , ' handiwork revealed purdue `` knew claim lie , sales reps , patients , medical professional even regulatory authorities best , oxy provided eight hours pain relief `` means patients exposed withdrawal symptoms , received inadequate care , often pushed higher dose oxycontin – puts patients increased risk death however , higher dosages make money frequent doses , clever , malevolent , marketing choice purdueyou see kind company caresabout public well-being , quite lot profits surprising purdue pharma , others like , spent nearly billion dollars trying protect hold american people 2006 2015 , big pharma spent nearly 200 times fighting opioid restrictions opioid restriction advocates spent time period sadly , big pharma pushing agenda even organizations many people consider `` respectable , '' dipped toes pond american cancer society , example , reportedly teamed pharmaceutical industryopioids similar heroin , prescribed patients pain relievers due highly addictive nature , surprise industry desperately wants protect ability prescribed anyone anything ; opioids cash cowdr andrew kolodny , tremendous supporter prescription opioid rem , told `` reaping enormous profits aggressive prescribing '' benefit , millions sufferover 2 million americans reportedly suffer addiction opioid drugs shy half-million people suffer heroin addiction , well national institute drug abuse reports roughly 80 percent heroin users report addiction began misusing opioid drugs prescription opioids rather expensive , surprise people eventually move less expensive options figure shows people currently using prescription opioids harmed drugs , many others well one could even postulate significant portion heroin overdoses could traced back opioids , addition thousands deaths caused opioids directly estimates indicate opioids related 60 deaths day spending $ 880 million protecting profits instead supporting legislation would help end opioid epidemic ensured priorities would easily understood despite claims big pharma companies like purdue actually care addiction people affected , becomeclear thethey care fact makes money",2018-01-25 16:17:44.789555,2018-02-02 01:19:41.756632,2018-02-02 01:19:41.756664,Big Pharma spent $880 million fighting against state opioid restrictions,"Friday, September, Vicki Batts",,"['opioids', 'Big Pharma', 'addiction epidemic', 'Big Pharma', 'drug', 'opioids', 'NaturalNews', 'prescription']",Big Pharma spent $880 million fighting against state opioid restrictions,,
177,177,27309,beforeitsnews.com,fake,http://beforeitsnews.com/healthcare/2014/09/cancer-causes-2458582.html,"cancer causes % readers think story fact add two cents headline bitcoin blockchain searches exceed trump ! blockchain stocks next ! let ’ see one american association cancer research announced preventable causes cancer us tobacco – quit years back cancer made fat ’ fat breast cancer treatment idea cancer causing pathogens go gym 3x week get 1 hour cardio time followed 30 minutes weights , machines , stretching fruits vegetables every day minimum two pieces fruit noon followed salad and/or green vegetables dinner never tanning salon go beach ’ remember last time got sunburn let ’ go back ‘ ? ’ question… let ’ anyhow discussion found ’ best source http//carolinemfrblogspotcom/2014/09/cancer-causeshtml",2018-01-25 16:17:44.789555,2018-02-02 01:19:41.756632,2018-02-02 01:19:41.756664,Cancer causes,Caroline'S Breast Cancer Blog,,[''],,,
