,Unnamed: 0,id,domain,type,url,content,scraped_at,inserted_at,updated_at,title,authors,keywords,meta_keywords,meta_description,tags,summary
113,113,19582,beforeitsnews.com,fake,http://beforeitsnews.com/survival/2015/06/playing-the-hitler-card-2574804.html,"playing hitler card headline bitcoin blockchain searches exceed trump ! blockchain stocks next ! redneck ’ guide reversing control brain matter historically incorrect , many people ( jews non-jews ) help use brainwashed minds play hitler card case point stephen lendman ’ recent post israeli viciousness israel treats palestinians way hitler persecuted jews every day kristallnacht long-suffering people apartheid conditions worse south africa ’ say incorrect israeli viciousness ( apparently vicious , murdering monsters ) argue defense palestinians ( agree ) smart people ( much like sweetie zuesse ) continually use standard erroneous brainwashing bolster point , direct opposition historical fact , makes opportunists best liars worst ’ think another subject erroneously engrained within psyche world devious jewish one using hitler , nsdap germany general , bolster sympathy jews/israel cover carnage world shown sweetie liar several times , lendman ( believe ) mistaken found using meme tify point lendman could used another example based upon truth let ’ accurate , shall ? bad lendman still uses hitler card , even attacking israel ( towards jews small degree ) truth hitler disgusted two nights nothing instigation implementation stain party totally direction desires really happened crystal night let us look really happened fateful night 1945 harm ever done jew national socialist germany described great detail many publications combined otherstories give exaggerated figures become so-called “ historical truth ” strange despite passage ty years , one established true extent damage done jews crystal night one learn history writers “ ” synagogues demolished “ ” shop windows destroyed aside vague description , one given almost details basis so-called “ historical truth ” crystal night , president world jewish congress , nahum goldmann , chutzpah 1952 claim 500 million dollars german chancellor konrad adenauer reparation payment damage done november night adenauer asked goldmann justification enormous request , goldmann replied “ find justification ! want justification money ” [ note 7 ] got money ! goldmann may interpreted willingness german chancellor pay half billion dollars proof claim synagogues destroyed else would germany foolish pay something never happened ? , “ historical truth ” “ ” german synagogues destroyed lie 1938 approximately 1,400 synagogues germany , 180 destroyed damaged furthermore , jews owned approximately 100,000 shops department stores germany 1938 number , 7,500 windows broken figures show much so-called “ historical truth ” differs actually happened damage destruction actually occur , course , terrible shame , exaggerations , especially german historians use condemn people , also shame history writers tell us crystal night jews frightened , meekly accepted whatever happened watched destruction property resistance contrary true going files subject , found many documents report precisely opposite claimed fact many cases jews german neighbors fought together attackers , pushing staircases street mobs beaten chased away one case police party officials generally side jews jewish community leaders went police stations next morning asked police investigate damage done synagogues resulting police reports still available files today also contrary told , jews directly affected events berlin , example , teachers pupils city ’ largest jewish school , served entire berlin area , appeared classes next morning without noticed anything unusual previous night heinemann stern , jewish principal school , wrote postwar memoirs noticed burning synagogue way school morning crystal night , thought accidental fire arrived school received telephone call inming destruction previous night went classes day first recess take trouble inm entire student body happened [ note 8 ] evidence reconciled claim herman graml , prominent german historian associate munich institute contemporary history , wrote “ every single jew beaten , chased , robbed , insulted humiliated sa tore jews beds , mercilessly beat apartments … chased almost death … blood flowed everywhere ” [ note 9 ] conceivable thousands jewish children would sent school parents morning fateful night attacks jews horrific extensive ? would parents let children go school thought even slightest danger attacked roving gangs sa men ? think answer clearly ! deplorable things indeed happen bad enough , fantasies modern historians history writers graml simply inexcusable really , ’ silly compare 2 day event , immediately shunned one lendman ( everyone else ) blames , half-century long apartheid ? something tells group trumps adolf card mentioned bee , lendman member h/t stevelendmanblog ihr ( institute historical review ) follow @ buelahman buelahuh ? rub wrong way stroke right ? let know comments section email buelahman { } g l { dot } com reason actually liked post , click “ like ” button feel like someone else needs see ( want ruin someone ’ day ) , click share button bottom post heap upon undeserving soul sad thought may , may remotely possible us rednecks revolt please enough ( likely , glutton punishment ? ? ) , feel overwhelming desire subscribe via email subscription and/or rss feed buttons found right hand panel page ( may lord mercy soul ) comment policy please keep comments relevant topic multiple links automatically relegate comment spam section , keep mind post 1st time commenters must receive admin approval , free reign posts opinions meant foster comment , reporting , teaching study “ fair use doctrine ” sec 107 us code title 17 statement fact made implied ads appearing blog solely product advertiser necessarily reflect opinions buehlahman ’ revolt wordpresscom filed jew world order , real history tagged adolf hitler , apartheid , crystal night , eric zuesse , germany , ihr , ingrid weckert , institute historical review , jews , kristallnacht , national socialist germany , nsdap , palestinians , stephen lendman , steve lendman , sweetie source https//buelahmanwordpresscom/2015/06/20/playing-the-hitler-card/",2018-01-25 16:17:44.789555,2018-02-02 01:19:41.756632,2018-02-02 01:19:41.756664,Playing The Hitler Card,B Mans Revolt,,[''],,"Crystal Night, Adolf Hitler, Eric Zuesse, Steve Lendman, Stephen Lendman, Apartheid, Kristallnacht, IHR, Jews, NSDAP, Palestinians, National Socialist Germany, Ingrid Weckert, Germany, Sweetie, Institute For Historical Review",
114,114,19639,unz.com,bias,http://www.unz.com/author/anatoly-karlin/topic/digital-philosophy/,"outline one core philosophies sublime oblivion demonstrate indivisibility material platonic worlds show universe almost certainly computer simulation nested within abstract computer program simulacrum , truth hides none consequences results explored read first series philosophical essays outline philosophy sublime oblivion demonstrate indivisibility material platonic worlds show universe almost certainly computer simulation nested within abstract computer program simulacrum consequences results explored fragmentary text found priests kǎichè , may live ever , great lord last empire , year 220 af contained far north khe resilience survived flame deluge ended age legends excavations ongoing site , read anatoly karlin blogger , thinker , businessman sf bay area ’ originally russia , spent many years britain , studied uc berkeley one tenets ideologies tend suck , hesitate attaching labels said , ’ really necessary , suppose “ liberal-conservative neoreactionary ” would close enough though consider part orthodox church , philosophy spiritual views influenced digital physics , gnosticism , russian cosmism anything specifically judeo-christian",2018-01-25 16:17:44.789555,2018-02-02 01:19:41.756632,2018-02-02 01:19:41.756664,Anatoly Karlin Archive,"Anatoly Karlin, Sayed Hasan, A. Graham, Black Pigeon Speaks",,[''],,"Digital Philosophy, 9/11 Articles, Race/Crime Articles, American Pravda Articles, ""Digital Philosophy"" Items Across Entire Archive, &udarr;, http://www.unz.com/author/anatoly-karlin/topic/digital-philosophy/, Race/IQ Articles",
115,115,19688,beforeitsnews.com,fake,http://beforeitsnews.com/alternative/2016/03/is-donald-trump-a-part-of-the-new-world-order-heres-why-the-question-video-3315249.html,"donald trump part new world order ’ question ( video ) % readers think story fact add two cents headline bitcoin blockchain searches exceed trump ! blockchain stocks next ! 3-6-16 video luke rudkowski talks rumors speculation surrounding donald trump involvement secret societies go recent advisors trump mentioned ties secret societies well revealing comments newt gingrich saying donald trump initiation rituals yet real independent media exclusive un-censored video site ! pro-jihad discussions san bernardino terrorist posted fb bee “ fiancé visa ” approved really think ’ used additional freedom speech restrictions obscene increase invasions privacy ? “ reviewing ” fb , websites emails contained possible terrorists , go across board means ! must see alternative video site uncensored videos , points view revealing disclosures covering almost every conceivable topic ! intiguing , safe site ‘ bee ’ news ’ approved ! gimick ; ’ real deal ​ ​​ completely prepared ? ’ important prep ! bible tells us every human sinned fallen short glory god heart-penetrating truth provided way cleanse us sins since never “ good enough ” cleanse avenue god ’ grace , mercy giveness ( cleansing sins ) begotten son , jesus christ nazareth equally god",2018-01-25 16:17:44.789555,2018-02-02 01:19:41.756632,2018-02-02 01:19:41.756664,Is Donald Trump a Part of the New World Order Here’s Why the Question (Video),Due Diligence,,[''],,,
116,116,19866,willyloman.wordpress.com,,https://willyloman.wordpress.com/2008/12/29/why-i-am-a-socialist/,"chris hedges , truthdig corporate ces looting treasury plunged us depression contained two main political parties democratic republican parties become little squalid clubs privilege wealth , whores money corporate interests , hostage massive arms industry , adept deception self-delusion longer know truth lies either find way mess embracing uncompromising democratic socialism—one insist massive government relief work programs , nationalization electricity gas companies , universal , -- profit government health care program , outlawing hedge funds , radical reduction bloated military budget end imperial wars—or continue fleeced impoverished bankrupt elite shackled chained surveillance state free market globalization , promised route worldwide prosperity , exposed con game mean corporate masters disappear totalitarianism , george orwell pointed , much age faith age schizophrenia “ society becomes totalitarian structure becomes flagrantly artificial , ” orwell wrote , “ ruling class lost function succeeds clinging power ce fraud ” ce fraud left use political shift europe toward open confrontation corporate state germany seen surge support die linke ( left ) , political grouping med 18 months ago co-led veteran socialist “ red ” oskar lafontaine , built career attacking big business two-thirds germans public opinion polls say agree die linke ’ platm socialist party netherlands verge overtaking labor party main opposition party left greece , beset street protests violence disaffected youths , seen rapid rise coalition radical left spain norway socialists power resurgence universal , especially france britain , shifts toward socialism significant corporations intruded every facet life eat corporate food buy corporate clothes drive corporate cars buy vehicular fuel heating oil corporations borrow corporate banks invest retirement savings corporations entertained , inmed branded corporations work corporations creation mercenary army , privatization public utilities disgusting -profit health care system legacies corporate state corporations loyalty america american worker tied nation states vampires “ [ commercial ] revolution deprived mass consumers independent access staples life clothing , shelter , food , even water , ” wendell berry wrote “ unsettling america ” “ air remains necessity average user still get , revolution imposed heavy tax way pollution commercial conquest far thorough final military defeat ” corporation designed make money without regard human life , social good impact environment corporate laws impose legal duty corporate executives make much money possible shareholders , although many moved fleece shareholders well 2003 documentary film “ corporation ” management guru peter drucker says “ find executive wants take social responsibilities , fire fast ” corporation attempts engage social responsibility , tries pay workers decent wage benefits , invests profits protect environment limit pollution , gives consumers fair deals , sued shareholders robert monks , investment manager , says film “ corporation externalizing machine , way shark killing machine ’ question malevolence enterprise within , shark within , characteristics enable designed ” ray anderson , ceo interface corp , world ’ largest commercial carpet manufacturer , calls corporation “ present day instrument destruction ” compulsion “ externalize cost unwary uncaring public allow externalize ” “ notion take take take take , waste waste , without consequences , driving biosphere destruction , ” anderson says short , film , based joel bakan ’ book “ corporation pathological pursuit profit power , ” asserts corporation exhibits many traits found people clinically defined psychopaths psychologist dr robert hare lists film psychopathic traits ties behavior corporations callous unconcern feelings others ; incapacity maintain enduring relationships ; reckless disregard safety others ; deceitfulness repeated lying conning others profit ; incapacity experience guilt ; failure conm social norms respect lawful behavior yet , american legal system , corporations legal rights individuals give hundreds millions dollars political candidates , fund army 35,000 lobbyists washington thousands state capitals write corporate-friendly legislation , drain taxpayer funds abolish government oversight saturate airwaves , internet , newsprint magazines advertisements promoting brands friendly face corporation high-priced legal teams , millions employees , skilled public relations firms thousands elected officials ward public intrusions affairs halt messy lawsuits hold near monopoly electronic printed sources inmation media giants—aol-time warner , general electric , viacom , disney rupert murdoch ’ newsgroup—control nearly everything read , see hear “ private capital tends become concentrated [ ] hands , partly competition among capitalists , partly technological development increasing division labor encourage mation larger units production expense smaller ones , ” albert einstein wrote 1949 monthly review explaining socialist “ result developments oligarchy private capital enormous power effectively checked even democratically organized political society true since members legislative bodies selected political parties , largely financed otherwise influenced private capitalists , practical purposes , separate electorate legislature consequence representatives people fact sufficiently protect interests underprivileged sections population moreover , existing conditions , private capitalists inevitably control , directly indirectly , main sources inmation ( press , radio , education ) thus extremely difficult , indeed cases quite impossible , individual citizen come objective conclusions make intelligent use political rights ” labor left-wing activists , especially university students well-heeled liberals , failed unite division , often based social rather economic differences , long stymied concerted action ruling elites fractured american left rendered impotent “ large sections middle class gradually proletarianized ; important point , rate first generation , adopt proletarian outlook , ” orwell wrote 1937 last economic depression “ , instance , bourgeois upbringing working-class income class belong ? economically belong working class , almost impossible think anything member bourgeoisie supposing take sides , side , upper class trying squeeze existence , working class whose manners manners ? probable , personally , important issue , would side working class tens hundreds thousands others approximately position ? far larger class , running millions time—the office-workers black-coated employees kinds—whose traditions less definite middle class would certainly thank called proletarians ? people interests enemies working class robbed bullied system yet many realize ? pinch came nearly would side oppressors ought allies quite easy imagine working class crushed worst depths poverty still remaining bitterly anti-working-class sentiment ; , course , ready-made fascist party ” coalitions environmental , anti-nuclear , anti-capitalist , sustainable-agriculture anti-globalization ces coalesced europe support socialist parties yet happen united states left never rallied significant numbers behind cynthia mckinney ralph nader picking lesser two evils , threw lot democratic party backs imperial wars , empowers national security state bidding corporations barack obama end flagrant theft taxpayer funds corporate slugs disgraceful abandonment working class , especially eclosures unemployment mount , many country turn desperation far right embodied groups christian radicals failure left offer democratic socialist alternative mean , eyes many embittered struggling working- middle-class americans , alternative perverted christian fascism inability articulate viable socialism gravest mistake ensure , soon change , ruthless totalitarian capitalism",2018-01-25 16:17:44.789555,2018-02-02 01:19:41.756632,2018-02-02 01:19:41.756664,Why I Am a Socialist,,,[''],"Chris Hedges, Truthdig The corporate forces that are looting the Treasury and have plunged us into a depression will not be contained by the two main political parties. The Democratic and Republican parties have become little more than squalid clubs of privilege and wealth, whores to money and corporate interests, hostage to a massive arms…",,
117,117,19984,beforeitsnews.com,fake,http://beforeitsnews.com/gadgets/2017/07/how-to-choose-a-good-vpn-service-2449655.html,"choose good vpn service ? % readers think story fact add two cents headline bitcoin blockchain searches exceed trump ! blockchain stocks next ! nowadays , vpn ( virtual private networks ) services become popular happened due numerous unsecured acts internet online fraud also concerning thing 2015 telegraph ( uk ) pointed almost 6 million offenses ( around one ten adults experienced ) way , hackers often hijack web clouds ( drive , dropbox ie ) mobile devices attaching case , best vpn service bestvpnrating withstand hacking attempts made individuals organizations violations cyber security reason 55 % businesses entities collaborate cyber security specialists 2016 companies ` statistical data safety primary reason virtual private networks use principle vpn described algorithm vpn like anonymous post address ( hence one contact ) = > visiting site , computer issue one vpn services ` ip addresses instead = > data site delivered first vpn servers , using secure channels = > seems using internet country vpn server located , wherever actually = > hackers able link real address find tips estimate vpn service though vpns offer similar functions , compared choose useful one servers pay attention many servers service include take account location/country list crucial 1 server country good make better efficient terms permance logging data better service keeps logging data use auto-matching logging check privacy policy terms service bee using vpn far data still collected , portion data used , day account logged , incoming ip address server , etc speed capacity usually goes limitations encryption methods list connection protocols service uses ( openvpn , l2tp , ikev2 , pptp , etc ) need understand details , multiple choice help make reliable connections perks individual service created fulfill additional need though make main functions vpn , attract customer unique proposal distinguish service ones ( taking account quite similar ) offer 3 vpn services rated top 10 different sources read description choose fits needs expressvpn service mostly “ picked ” one customers point high reliability , speed , support advantages + 145 server locations access 94 countries ; + wide encryption methods choice – openvpn ( tcp , udp ) , l2tp-ipsec , sstp , pptp protocols 256-bit encryption ; + bandwidth speed ; + strict privacy policy logging network traffic ; + 3 device connections time ; + 30 days free service sign-up 30-day money back guarantee disadvantages - relatively high price ( month — $ 832/month , 6 months — $ 999/month , 1 month — $ 95/month ) hidemyass vpn advantages + impressive digits 910+ servers , 340 + locations , 190 + countries , 0000 + ip addresses ; + encryption methods choice — openvpn , l2tp , pptp ( 256-bit encryption software combined security protocols ) ; + logging metadata ; + perks anonymous email , secure file download , protection hackers , viruses spam , well so-called “ secure ip binding ” — function dynamically assigning ip addresses powerful encryption session disadvantages - 2 device connections session ; - english friendly translation web ; – bandwidth speed ipvanish vpn advantages + easy set use ( user-friendly devices ) ; + 700 + servers , 60+ countries ; + encryption methods choice — openvpn , l2tp , pp2p ; + zero traffic logging , anonymous torrenting ; + 5 simultaneous connections multiple devices disadvantages - 7-day money-back guarantee ; - price ( month — $ 649/month , 3 months — $ 899/month , 1 month — $ 1000/month )",2018-01-25 16:17:44.789555,2018-02-02 01:19:41.756632,2018-02-02 01:19:41.756664,How to choose a good VPN service?,,,[''],,,
