,Unnamed: 0,id,domain,type,url,content,scraped_at,inserted_at,updated_at,title,authors,keywords,meta_keywords,meta_description,tags,summary
58,58,9757,canadafreepress.com,conspiracy,http://canadafreepress.com/print_friendly/how-hud-makes-lousy-programs-look-great,"subscribe canada free press free money , government usurping rights homeowners local officials , causing harm low-income families deprived real help need succeed hud makes lousy programs look great federal agencies promote programs , like affirmatively furthering fair housing , common core conduct sophisticated often deceptive marketing campaigns cover downsides flowery slogans like , “ transportation options fundamental shot american dream , ” “ economic diversity path better outcomes american children , ” may sound moving truth programs often disturbing department education ( used ) dot use phrases market federal scheme regionalize densify communities shuffling students new communities name “ income diversity ” ( id government ’ buzzword student ’ path success ) whether programs “ protect environment ” , ( regional sustainable development , ) develop “ college career ready ” children ( common core , ) create platm “ improve adult outcomes ” ( hud ’ affh , ) agencies pump benefits uninitiated public , little regard destructive effects plans private business engaged similar deceptive practices government , consumer financial protection bureau would probably fine business untunately , consumers little protection federal dishonesty dysfunctional congress disturbingly powerful executive , inmed citizens working local public officials protect interests four common ways government deceives american people cherry-picked reports federal agencies start projects public may reject , often cite research studies proving wisdom importance program “ research ” also demonstrates agency ’ professionalism due diligence studies often little weak justifications programs frequently cause harm benefit communities intended beneficiaries one example hud ’ “ move opportunity ” ( mto ) , revived 1994 “ randomized social experiment , ” transferred low-income families higher income areas improve access better education jobs 2011 hud report revealed mto program reduce incidence “ extreme obesity ” “ major depression ” among randomized families , according analysis , 15 years , project “ failed improve education , employment income outcomes ” food stamp usage rose , “ males experimental group arrested often control group , primarily property crimes , also likely engage variety delinquent risky behaviours ” blatant failures dissuade hud reintroduced program since 2011 , series new studies micro-analyzed original results , finding positive nugget among dismal results finally , august 2015 report , “ effects exposure better neighborhoods ” , concluded , mto , children age 13 earned money , likely attend college , girls less likely become single mothers “ groundbreaking ” study virtually ignored negatives original research wasted sentences plights children 13 reported “ lower incomes ” worse outcomes never moved hud officials also disregarded report ’ critical observation , “ mto experimental design used conclusively establish childhood exposure better environment causal effect long-term outcomes… ” hud proceeding program , 15 years , researchers show conclusive proof works broader concerns administration ignores aggressive pursuit methods reduce incidence single parent families , increase local educational opportunities , even though researchers recognize solutions improving educational outcomes important incomes hud even within legal bounds ? hud advancing mto program affirmatively furthering fair housing rule yet , nothing fair housing act entitles hud transfer people gain income integration , engage many actions taking affh continued hear research , see research hud department education believe poor student permance primarily result living concentrated areas poverty remedy , agency intends relocate low-income families better neighborhoods improve educational income outcomes low-income family , seems like boon would want move nicer area , especially someone else paying ? , conclude moving affluent areas best solution improve outcomes , hud ignore volumes research findings prove location prime driver scholastic ability moving families locations adults children friends relatives areas afd , brings challenges 2011 study , “ effects poverty academic achievement ” concludes income mother ’ level education significant factors determining educational outcomes “ many studies , mother ’ education significant effect children ’ scores income ” author ’ recommend “ instructional techniques strategies help close achievement gap providing students necessary assistance order achieve high standards academic permance ” recommendation uproot families move affluent areas 2014 study , sponsored prestigious harvard program education policy governance , education next , reveals child ’ educational disadvantages result parents ’ educational levels live “ among students families low parental education , us literacy proficiency disastrous 18 percent , far 42 percent mark reached students high parent education ” pursuing income diversity , hud ignores best way improve grades opportunities shuffle families new neighborhoods , educate families importance two-parent households , effects fathers children ’ education , value education family members instead , hud , dot department education moving ahead regional equity assistance centers part president obama ’ stronger together program , ( see page 22 ) teach local educators attain income diversity classrooms means improve educational outcomes twisted logic economic mobility reasoning behind one administration ’ aggressive programs relocate low-income families better areas sounds reasonable , ignores real causes economic immobility deprives next generation mental tools necessary compete succeed economic mobility ability individuals move earnings ladder greater mobility associated job opportunities , wealth accumulation personal freedom one time , americans easily migrated poor middle class , since 1980 ’ slowed today , us one least economically mobile first world nationsthe main causes immobility technological advances reduced need many middle income positions ; importantly , recession recovery added high paying jobs upper class , service oriented work low-income brackets , little middle class fewer middle class opportunities , poor stuck nowhere advancethe administration right conclude economic mobility factor success success requires organic mobility , federally mandated mobility desiring , striving overcoming whatever disadvantages may part success modelto help poor families improve , hud-used-dot wants relocate schoolchildren elementary secondary grades gain economic diversity classroom accompanying program , small area fair market rents , hud families find section 8 vouchers reduced lower income zip codes raised wealthier neighborhoods , cing move affluent areas , regardless wishesthe president touts misguided program “ fundamental ” children ’ success rationale akin absurd conclusion , “ well-to-do families drive bmw ’ , theree , buy beamers low-income families , share success higher earners ” logic , could even provide study proving owners new subsidized bmw ’ psychologically content , arrive work faster , return home early enough spend quality time family help kids schoolwork fool people , time government agencies frequently mislead local public officials public including wording documents implies opposite regulation actually accomplishes case point administration ’ affirmatively furthering fair housing rule utilizes fair housing act eliminate segregation discrimination seems like good cause , practice , program little eliminate discrimination impose aggressive oversight community planning regulatory comment period affh , astute responders questioned hud ’ “ intrusion local affairs responsibilities , ” particularly zoning agency released comting statement “ rule impose land use decisions zoning laws local government ” ( see page 140 ) statement deceptive hud directly impose land use decisions zoning laws , indirectly ce impose community discovered , charges failure affirmatively fair housing , civil rights violations , threats withdraw grant money legal actions , hud coerce communities compliance zoning requirements , even voters disagree would nice think agency uses authority face flagrant civil rights violations case westchester county ny , spite on-track meet court settlement requiring county build 750 new afdable homes , hud affiliated monitor wanted community adopt “ model zoning ordinances ” one point , agency notified county executive rob astorino ¼ acre building plots represented “ exclusionary zoning , ” low-income families afd hud expands authority , also expand interpretations constitutes segregation discrimination , leaving communities accepted grants tenuous position handful federal programs cost taxpayers millions wasted dollars programs like economic recovery reinvestment act , afdable care act common core many , many times waste , intentional misrepresentation flawed outcomes money , government usurping rights homeowners local officials , causing harm low-income families deprived real help need succeed many communities discovering , better moving ahead without federal interference",2018-01-25 16:17:44.789555,2018-02-02 01:19:41.756632,2018-02-02 01:19:41.756664,How HUD Makes Lousy Programs Look Great,"John Anthony, Because Without America, There Is No Free World.",,"['Conservative News', 'Conservative Newspaper']","News, Politics, Editorials, commentary, Canada Free Press, Because without America, there is no Free World",,
59,59,10186,washingtonexaminer.com,political,http://www.washingtonexaminer.com/justice-department-asks-supreme-court-to-overturn-daca-ruling/article/2646397,"department justice thursday mally asked us supreme court overturn lower court ’ ruling block , part , trump administration ’ decision phase deferred action childhood arrivals program unusual step bypasses us 9th circuit court appeals , would normal move overturn us district judge william alsup ’ ruling last week , san francisco-based judge ordered trump administration renew parts daca start accepting renewal applications already part program related lawsuits make way legal system however , alsup demand new applications accepted tuesday , attorney general jeff sessions said alsup ’ ruling “ defies law common sense ” said department ’ supreme court request would happen week 's end daca , impacts roughly 700,000 people dubbed “ dreamers , ” set expire march 5 sessions announced september trump administration rescinding obama-era program congress tasked passing legislation keep dreamers — defined people entered country minors — risk deportation",2018-01-25 16:17:44.789555,2018-02-02 01:19:41.756632,2018-02-02 01:19:41.756664,Justice Department asks Supreme Court to overturn DACA ruling,Kelly Cohen,,"['Dream Act', 'Law', 'Justice Department', 'Kelly Cohen', 'Jeff Sessions', 'Supreme Court', 'Immigration', 'News', 'Politics']","The unusual step bypasses the U.S. 9th Circuit Court of Appeals, which would have been the normal move to overturn U.S. District Judge Willi...",,
60,60,10417,washingtonexaminer.com,political,http://www.washingtonexaminer.com/flyover-country-farmers-and-dc-bureaucrats-push-philadelphia-refinery-into-bankruptcy/article/2646687,"crowd enveloped bus daredevils scaled greased light poles someone started lighting fireworks scene outside lincoln financial field boisterous eagles fans celebrated 38-7 victory minnesota vikings celebration much-needed , philadelphia losing elsewhere thirty minutes game , three miles away stadium , workers oil refinery owned philadelphia energy solutions inmed jobs jeopardy reuters reported sunday company soon file bankruptcy , 1,100 employees might need start looking new line work jobs secure years — refinery largest oil refining complex east coast soon-to-be unemployed direct anger ? farmers flyover country bureaucrats washington , dc refinery going broke , reuters reports , largely government since 20 , philadelphia energy solutions spent $ 800 million comply renewable fuels standard , ces refiners blend certain amount biofuels fuel supply purchase credits complying regulation refiner ’ second-biggest cost purchasing actual crude oil refine eagles head super bowl first sunday february hopefully team bring back win philadelphia going need",2018-01-25 16:17:44.789555,2018-02-02 01:19:41.756632,2018-02-02 01:19:41.756664,Flyover country farmers and DC bureaucrats push Philadelphia refinery into bankruptcy,Philip Wegmann,,"['Philip Wegmann', 'Philadelphia', 'Bankruptcy', 'Ethanol', 'Energy and Environment', 'Opinion', 'Beltway Confidential']","Since 2012, Philadelphia Energy Solutions has spent $800 million to comply with the Renewable Fuels Standard.",,
61,61,10657,beforeitsnews.com,fake,http://beforeitsnews.com/gulf-oil-spill/2015/11/iraqs-oil-industry-and-current-economic-outlook-2441872.html,"iraq ’ oil industry current economic outlook % readers think story fact add two cents headline bitcoin blockchain searches exceed trump ! blockchain stocks next ! iraq ’ oil history outlook , part two iraq destined become regional global superpower based richness oil wealth , young democracy sits atop world ’ second-biggest reserves high-quality petroleum iraq ’ future seems bright indeed regardless current political squabbling , oil-fueled iraqi economy continues grow rapidly ’ perennially rated one world ’ top ten fastest-growing economies , ’ plenty room additional expansion still , order see clearest view iraqi economy may look like five ten years , ’ helpful take look history iraq ’ oil industry well new oilfield technologies increasing iraqi production revenues part one , looked history iraq ’ oil-based economy well political economical developments leading rise saddam hussein control nation ’ economy let ’ take look iraq ’ oil industry current economic outlook , particularly mean value iraqi dinar , beginning turning point coalition invasion 2003 ousted saddam beginning end saddam us-led invasion occupation iraq quickly ended saddam hussein ’ ruthless 30-year regime , also beginning new era iraq ’ long-neglected oil industry saddam cronies gone , nation soon entered period unprecedented economic growth fueled booming oil industry dust settled 2003 invasion , american , european middle eastern oil companies quickly arrived , ready business much work done oil industry infrastructure kurdish region northern iraq relatively unscathed actual fighting war still , oilfield equipment facilities suffered years neglect due shortage replacement parts new technologies made unavailable years un-imposed trade embargo economic sanctions southern central iraq , scene different gulf war 1991 fighting 2003 , approximately 60 % oil production refinery facilities regions damaged apart impact economic sanctions war , saddam stunted country ’ oil industry even mandating reservoir-management policies resulted lower production several years departure wells over-pumped , cases permanently reduced future outflows , attempt boost yields lagging equipment maintenance issues , iraqi engineers reinjected excessive amounts low-end petroleum fractions back ground reinjection standard industry technique increasing well ’ output however , iraqi petroleum engineers reinjected overly-viscous oil constituents back wells , slowed output several years saddam ’ departure huge reserves compensate missteps regardless mismanagement saddam , fact iraq ’ overall oil production soared since departure illustrates enormity iraq ’ reserves resiliency industry spite thirty years bungling , iraq steadily achieving higher oil production totals almost every year since saddam ’ demise according conservative estimates dating 2001 , iraq believed least 145 billion barrels oil remaining tapped , several more-recent estimates nearly doubled figure geographically , iraq ’ known petroleum reserves lie belt runs roughly north south along eastern side country iraq least 10 fields known “ super giants ” ( minimum 5 billion barrels ) another 25+ “ giant ” fields ( minimum 1 billion barrels ) leading petroleum engineers indicated southeastern iraq ’ cluster super-giant fields world ’ largest concentration fields , accounting 80 % country ’ reserves remaining 20 % known reserves found northern region kirkuk , khanaqin mosul , seems plenty room oil discoveries – iraq unique tiny fraction known reserves development , even though already exports enormous amounts crude oil development continues , oil gushes th fact , since 1925 2,200 wells drilled throughout iraq comparison , approximately one million wells already drilled state texas alone iraq also “ full gas ” country ’ proven reserves natural gas approximately 115 trillion cubic feet , fifth-largest world two-thirds known gas reserves located southern iraq , rest north back work event , soon saddam gone iraqi oil industry began returning normal years 2003 2008 , iraq busily repairing civilian infrastructure damaged war well upgrading long-neglected oilfields 2008 iraqi government announced new plan work world ’ largest oil companies – shell , exxonmobil , bp total , original partners iraq petroleum company ( ipc ) dating back 1929 plan quickly replaced even larger , comprehensive plan develop iraq ’ oilfields 2009 iraqi ministry oil mally awarded service contracts original “ big oil ” companies well several international firms including chevron oilfields contract development include iraq ’ “ super-giant ” fields halfaya , majnoon , west qurna , rumaila china national petroleum corporation ( cnpc ) bp contract develop rumaila field , iraq ’ largest single field result agreements iraq able increase production dramatically 2009 iraq risen near-zero production end saddam ’ reign become world ’ twelfth-largest producer 2010 us government allocated $ 2 billion help develop modernize iraqi oil gas industry , although direct involvement managing industry ended 2008 end 20 iraqi oil production risen nearly 35 million barrels per day , 2014 another milestone reached production averaged 36 million barrels per day , level achieved since 1979 2014 brief glitch arose kurdistan regional government ( krg ) seized control several northern oilfields dispute central government baghdad regarding revenues tunately , early 2015 least temporarily resolved , oil flows returned normal since newer technologies boost iraqi output 2015 , iraqi oil production already benefiting new technologies unavailable years un trade embargo past years newer technologies introduced iraq international oil companies using methods increase oilfield yields countries given iraq ’ huge reserves , nation ’ oil industry certainly gain maximum benefit technologies important new technologies directional drilling hydraulic fracturing , promise help boost iraqi production exports significantly directional drilling bee 1970s , wells drilled vertically , hole drilled straight downward reached oil , , 1973 several drilling companies developed techniques slant drilling , early directional drilling allowed hole drilled slight angle directional drilling equipment allows drill bit move curving line rather straight line , snake way around underground obstacles unusually hard rock mations fact , given enough depth , wells drilled horizontally , , parallel surface land first practical benefit directional drilling allows drillers reach oil reservoirs several miles away site drilling rig current technology allows drillers drill far 6 miles away laterally , example , directional drilling allows land-based rigs drill offshore locations , significantly reduces production expenses , oil located steep mountains likewise tapped nearby flatlands importantly iraq , directional drilling allows producers increase length underground pipe exposed reservoir instead simply end pipe inserted oil reservoir , directional drilling fairly long perated section pipe placed contact oil critically important ensuring high flows well completed , since oil sucked much larger surface area iraq directional drilling enables producers overcome sluggish flows resulted saddam ’ policy over-drawing oil wells reinjecting thick , undesirable residues back ground hopes obtaining short-term increases flow , mentioned , directional drilling also makes possible multiple wellheads draw oil single drilling site , extended length perated pipe exposed oil reservoir means greater yields likewise , directional drilling also allows single wellhead draw oil and/or gas within several different geologic strata ( layers rock ) different depths , something impossible older perpendicular drilling methods introduction directional drilling technologies helped iraq dramatically increase production , technologies hold promise even greater yields future hydraulic fracturing hydraulic fracturing , sometimes also called fracking , method stimulating wells produce oil effectiveness fracking discovered series experiments 1947 , first commercial application came 1950 although communities us debated use fracking domestic production , iraq practice potential godsend may allow oil producers significantly increase wells ’ outputs water containing suspension sand constituents injected high pressure well order create cracks oil-bearing rock cracks allow oil flow freely within underground reservoir , theree extracted hydraulic fracture created underground pumping fracturing fluid wellbore order increase underground pressure enough crack rock rock cracks , fracturing fluid continues onward , extending cracking fracking equipment operate pressures flow rates 15,000 pounds pressure per square inch ( psi ) inbound flows fracking fluid high 100 barrels per minute sand materials called proppants added fracking fluid order “ prop open ” cracks already created , ’ close oil flowing outward propped-open fractures allow oil gas trapped within rock easily flow outward ’ estimated fracking increases oil production average 17 % , natural gas production average 45 % importantly , used together fracking directional drilling synergistic effect – yields together may substantially higher used separately outlook given huge oil reserves long-term commitments international oil companies develop oil gas fields , iraq certain bright economic future measured ever-increasing volume oil exports , country ’ oil industry fully recovered damage mismanagement suffered saddam hussein ’ reign notwithstanding iraq ’ already-known reserves , seems likely recent new exploration efts oil companies lead even greater tally iraq ’ oil wealth ’ also important note iraq ’ blessed large reserves , also happens geologic mations holding iraq ’ oil much accessible drilling countries , means costs extracting oil much lower significant iraq profitably produce petroleum prices less $ 40 per barrel contrast , us shale oil costs $ 90 $ 100 per barrel produce , even cost-effective wells texas generally require global oil price least $ 40 per barrel order profitable , iraq afd pump sell oil prices producing nations production advantages visible recent saudi arabian oil-production war designed bankrupt us shale-oil producers oil producers us elsewhere severely impacted saudis ’ overproduction , iraq continues produce profitably oil drives iraqi dinar given world ’ insatiable appetite oil gas , iraq ’ dominant supply role likely become even stronger going ward although ’ difficult predict future certainty , seems likely sometime near future iraq grow regional international energy super-power based rich reserves fact , iraq seems on-track replace saudi arabia region ’ wealthiest , most-developed nation within next years mean dinar ? nation ’ economy , well value currency , depends natural resources iraq ’ exceptionally large oil reserves like “ money bank , ” available meet young democracy ’ needs continues grow eventually value iraqi dinar rise reflect true value country ’ oil wealth seems likeliest occur central bank iraq ( cbi ) frees dinar artificially-low value placed 2003 following darkest days saddam hussein ’ regime occurs , strength iraq ’ economy rapidly become obvious observers worldwide , simply individuals taken time research event , knowledge key success learn status iraqi oil industry affects dinar , click currency liquidator ’ iraqi dinar blog",2018-01-25 16:17:44.789555,2018-02-02 01:19:41.756632,2018-02-02 01:19:41.756664,Iraq’s Oil Industry and Current Economic Outlook,Pawan Kadu,,[''],,,
62,62,11001,beforeitsnews.com,fake,http://beforeitsnews.com/stories/category/health.html,54 looking lyme disease friday dec 29 2017 0424,2018-01-25 16:17:44.789555,2018-02-02 01:19:41.756632,2018-02-02 01:19:41.756664,"Stories in the ""Health"" category",,,[''],,,
