Unnamed: 0.1,Unnamed: 0,id,domain,type,url,content,scraped_at,inserted_at,updated_at,title,authors,keywords,meta_keywords,meta_description,tags,summary
132,132,21862,beforeitsnews.com,fake,http://beforeitsnews.com/marijuana-debate/2016/09/the-reason-a-record-number-of-states-can-vote-to-legalize-weed-this-fall-2451045.html,reason record number states vote legalize weed fall headline bitcoin blockchain searches exceed trump blockchain stocks originally published blognormlorg ofwho support full legalization marijuana greatly benefiting political reforms adopted frequently referred progressive era country principal objective progressive movement eliminating corruption government accomplish goal proponents sought ways powerful corrupt political bosses provide access ordinary americans political system concept called direct democracy contrasted representative democracy period concept direct primaries nominate candidates public office direct election ofsenators universal suffrage women gained traction important work procedures known referendum initiatives began adopted several states <NUM> oregon state adopt option initiative referendum change public policy permitting citizens directly introduce approve proposed laws constitutional amendments process called initiative change originated action citizens without involvement legislature referendum originated legislature referred voters decide <NUM> total <NUM> states adopted provisions modeled oregon system today total <NUM> states offer voter initiative rest states avenue change public policy state legislature brief history direct democracy relevant today access direct political action voters allowed marijuana legalization move forward earlier politically possible action state legislatures four states district columbia approved full legalization adults five states voting full legalization november rely voter initiatives progressive procedures worked precisely intended back progressive era allowed citizens go around establishment alter status quo voter initiatives unpopular among elected officials altering status quo taken place without legal kicking screaming elected officials states comes surprise elected officials appreciate fact public policies states necessary changed without consent approach end summer coming fall elections examples extraordinary resources establishment politicians antimarijuana zealots willing invest try prevent citizens states voting directly marijuana policy reason course obvious according recent national polls clear majority american public <NUM> <NUM> percent supports end marijuana prohibition given opportunity vote issue vote legalize marijuana elected officials otherwise claim represent voters states selfappointed moral guardians go great lengths try stop votes happening democracy something support long public favors policies favor public gets ahead establishment democracy damned use tools available including procedural constitutional challenges avoid allowing voters decide issue full legalization proposals full legalization measures ballot five states fall maine massachusetts nevada arizona california sixth michigan qualified lastminute legislation several states pending initiatives establishment prohibitionists gone court desperate effort courts intervene keep measures ballot maine secretary state matthew dunlap attempted invalidate significant number signatures gathered campaign regulate marijuana alcohol maine arguing signature single notary match file state fortunately superior court justice michaela murphy overruled dunlap decision signatures recounted measure question <NUM> qualified ballot massachusetts secretary state qualified legalization initiative ballot group prohibitionists calling safe healthy massachusetts campaign sued measure removed ballot claiming violated constitutional limitation prohibiting initiative dealing unrelated topics challenge subsequently dismissed massachusetts supreme judicial court measure question <NUM> appear november ballot arizona group calling arizonans responsible drug policy including prominent country prosecutors arizona chamber commerce filed suit try keep legalization initiative ballot qualified secretary state group claimed <NUM>word summary limit set statute accurately reflect everything contained <NUM>page proposal maricopa county superior court judge jo lynn gentry rejected argument approved measure proposition <NUM> ballot california big enchilada <NUM> elections state opponents initiative permitted include ballot reasons opposing proposal proponents went court yes <NUM> advocates successfully challenged six arguments opponents wanted appear ballot superior court judge shelleyanne wl chang found six false misleading ordered opponents modify arguments falsely claimed initiative permit promarijuana ads appear radio television appeal children michigan proponents mi legalize turned sufficient number signatures <NUM> qualify legalization measure ballot state legislature quickly rammed new law june declaring signatures older <NUM> days invalid leaving proponents shy required number signatures proponents filed suit state challenging new limitations constitutional grounds appears appeal decided initiative appear <NUM> ballot appeal succeeds five fulllegalization initiatives appear ballot fall nevada initiative question <NUM> free court challenge nevada secretary state ross miller certified proposal ballot end <NUM> certainly organized opponents none elected challenge measure court moving forward short term proponents legalization continue focus efforts states offer option voter initiative long elected officials establishment interests represent continue support status quo prohibition makes sense strategically bypass state legislature possible strategy must eventually evolve <NUM> states simply offer option half country win oldfashioned building majority support among state legislators pass proposal legislature significant challenge sure demonstrated drive legalize medical marijuana states adopted legalization voter initiative enacting legalization statute become realistic live <NUM> states without initiative process must continue painfully slow process convincing individual legislators prohibition marijuana failed public policy full legalization makes sense already understand continue fear labeled soft drugs acknowledge obvious frustrating win supporters year becomes easier public support legalization continues increase elected officials ignore wishes constituents peril ___________________________________________________________ column ran attn <URL> voterinitiatives source <URL> recordnumber statescanvote legalizeweedthisfall/,2018-01-25 16:17:44.789555,2018-02-02 01:19:41.756632,2018-02-02 01:19:41.756664,The Reason a Record Number of States Can Vote to Legalize Weed This Fall,Norml Foundation,,[''],,,
78,78,13153,beforeitsnews.com,fake,http://beforeitsnews.com/gold-and-precious-metals/2018/01/cryptocurrencies-leg-lower-after-south-korean-tax-headlines-3178892.html,cryptocurrencies leg lower south korean tax headlines readers story fact add cents headline bitcoin blockchain searches exceed trump blockchain stocks update 1100et headlines south korea yonhap news regarding new tax rules cryptocurrency exchanges appear sparked latest leg cryptocurrencies cointelegraph reports local news agency yonhap reports south korean government announced monday jan <NUM> collecting <NUM> percent corporate tax <NUM> percent local income tax country cryptocurrency exchanges tax announcement comes right conclusion unprecedented antimoney laundering probe six major south korean banks showed <NUM> times increase commissions virtual accounts linked crypto exchanges <NUM> mln <NUM> <NUM> <NUM> bln <NUM> mln <NUM> yonhap reports south korean exchange bithumb made <NUM> bln <NUM> last year total expected pay <NUM> mln taxes according tax percentages announced monday announced tax percentages line south korean tax code corporations yearly income <NUM> bln <NUM> mln cryptos legged lower slightly odd since suggests shutdowns cards government go logistics taxation merely shutter accounts south korean bank blocks bulgarian ponzi scheme shutdowns bali bitcoin crackdown pick driving sudden plunge cryptocurrencies morning ethereum back <NUM> bitcoin back 10k handle ripple <NUM> weekend highs weakness began around 6amet really accelerated around 8am et bitcoin ethereum breaking key support levels catalyst move uncertain best numerous headlines weekend onecoin offices raided servers seized sofia bulgaria jan <NUM> <NUM> yet another step series international raids court cases highlycontroversial altcoin although servers shut onecoin currently remains operational jan <NUM> <NUM> yet another step series international raids court cases highlycontroversial altcoin although servers shut onecoin currently remains operational bitcoin exchanges fire india nation top banks suspended greatly curtailed functionality exchange accounts state bank india sbi axis bank hdfc bank icici bank yes bank taken strong action toward crypto exchanges either closing accounts severely limiting functionality banks cite risk dubious transactions according local reports nation top banks suspended greatly curtailed functionality exchange accounts state bank india sbi axis bank hdfc bank icici bank yes bank taken strong action toward crypto exchanges either closing accounts severely limiting functionality banks cite risk dubious transactions according local reports biggest nordic bank sent memo employees monday informing allowed trade bitcoin cryptocurrencies nordea bank ab impose ban feb <NUM> board agreed stand due unregulated nature market spokeswoman afroditi kellberg phone bank <NUM> employees end third quarter nordea bank ab impose ban feb <NUM> board agreed stand due unregulated nature market spokeswoman afroditi kellberg phone bank <NUM> employees end third quarter bitcoin heavy surveillance bali island indonesian archipelago according local reports central bank officials seeking crack use cryptocurrency anywhere nation note recent plunge occurred bitcoin broke <NUM>day moving average <NUM> noted yesterday bitcoin futures short keeps growing short overhang growing weekly wonders long short squeeze whether due longoverdue bullish catalyst reason unleashed bitcoin futures quickly cascading spot market potentially unleashing move higher cryptocurrency space year date ethereum remains big winner major cryptos finally reminder january weakness bitcoin unusual appears prelunarnewyear selloff prevalent source <URL>,2018-01-25 16:17:44.789555,2018-02-02 01:19:41.756632,2018-02-02 01:19:41.756664,Cryptocurrencies Leg Lower After South Korean Tax Headlines,,,[''],,"Bithumb, India, South Korean, altcoin, Indonesian",
186,186,28983,beforeitsnews.com,fake,http://beforeitsnews.com/strange/2017/10/multiple-disasters-means-stretched-resources-donor-fatigue-2469351.html,multiple disasters means stretched resources donor fatigue headline bitcoin blockchain searches exceed trump blockchain stocks something modern civilization counted upon times crisis outside help better situation news disaster travels around region sometimes whole areas world people donate money assist bad process decline hastened climate change limits reached resources strained breaking disasters pile npr article process unfolding year wwwnprorg/sections/goatsandsoda/<NUM>/<NUM>/<NUM>/<NUM>/what pileup usdisastersmeans world listing donations every subsequent disaster year showing marked decline article goes say happened world already grappling largest humanitarian crises since world war ii <NUM> million people risk dying starvation disease due conflicts drought nigeria somalia south sudan yemen within thegovernment exclusively domestic agencies fema allhandsondeck mode right cdc talley works branch focuses overseas emergencies staff around world responding similarly usaid agency deliversassistance poor countries deployed six separate disaster response teams consist several dozen staffers including teams help displaced people syria iraq second six teams mobilized notes alex mahoney top official agency office offoreign disaster assistance ofda last ebola outbreak west africa yes unusual says well worth reading explains agencies world rely onsupport including us stretched limits beyond donations dropping process called donation fatigue due private parties governmental organizations using volunteers resources either left replacements slow arrive appears disasters pile well face unthinkable little help timing appears part problem lack help puerto rico instance devastating fires california point funds active participants commission believe climate change means last soon maybe within decade well local disasters met local help devastating disaster survivors find mean collapse modern civilization far less typical declines previous eras mentality generosity strangers shift battening hatches area people hope longer maintain infrastructures constant contact around world easier descent ultimately source <URL>,2018-01-25 16:17:44.789555,2018-02-02 01:19:41.756632,2018-02-02 01:19:41.756664,Multiple Disasters Means Stretched Resources & Donor Fatigue,Towards A New World,,[''],,,
143,143,23066,beforeitsnews.com,fake,http://beforeitsnews.com/spirit/2015/06/mary-magdalene-healing-shame-around-addictions-and-sexuality-2494766.html,mary magdalene healing shame around addictions sexuality headline bitcoin blockchain searches exceed trump blockchain stocks received mercedes kirkel april <NUM> <NUM> note mercedes excerpt channeled reading client graciously agreed share portion universal nature profundity mary responses question question releasing shame life felt good enough bad something wrong currently going therapy substanceabuse problem healing big part healing releasing shame guidance give helpful mary magdalene wonderful identified connection shame using substances getting deep level healing occur acknowledge awareness connection openness healing shame carry particular arenas life feel experience shame questioner big substanceabuse problem feel shameful wrong bad substance abuse prescription medications got hand working feel shame spent last ten life substanceabuse problem mary magdalene medications originally prescribed questioner attention deficit disorder really sensitive helped kind shut feelings focus work sometimes cut world sensitive emotional need work practical life prescribed point want medication want love respect body mary magdalene simply wanting medication prescribed taken medication ways prescribed questioner taken ways prescribed working therapist past months able acknowledge honest guidance getting help shame feel around another shame started really young shame starting realize really young still diapers masturbated growing catholic household knew shameful still feel shame around young know mary magdalene thank speaking shame speaking difficult fear ostracized abandoned show people part feel shame speaking beginning healing shows become aware honest going areas shame begin find people trust safe share open part great step healing need discernment speaking others important open people discern safe people safe open people understand hold events necessary wise open people choice people safe open people supportive open actually help ways wanting help aware choice start empower choice rather effect random responses random individuals part feel questioner feels good gives lot security guidance mary magdalene yes beginning reclaiming personal power shame given away part power someone entity probably trusted stage life currently realize entirely trustable entirely highest good gave messages bad wrong sinful evil somehow bad wrong sinful evil deficient right good enough engaging certain behaviors sad state affairs thirddimensional issue thirddimensional consciousness strong belief dualities goodbad rightwrong evilgodly kinds higher dimensions differently kinds dualities quite destructive quite harmful people spiritual growth spiritual path part spiritual process third dimension realizing people programmed kind thinking certain good certain bad certain godly certain ungodly kind thing beliefs given choice hold beliefs suggest different possibility point view part transcendence third dimension moving higherdimensional consciousness possibility thing goodbad thing rightwrong experiences either supporting supporting divine growth unfoldment young touching experiencing sexual energy forms touch selfpleasuring whatever certainly bad wrong point view completely natural thing becoming aware physical body energyincluding sexual energy connected physical body exploring healthy learning walk exploring physical body possibilities mobility bad wrong evil exploring movement walking certainly bad wrong evil learning exploring sexual energy physical sexuality unfortunate institutions catholic church promoted belief bad wrong sinful whatever consider natural thing healthy thing sexuality part evil appetite food people call hungry meal evil hunger simply energy body connected physical systems natural body true sexuality however sexuality potential connecting god profound people profound bodily functions fact religious institutions tried convince people sexuality bad wrong whatever belief believed understood sexuality natural healthy important vital part life connection god naturally empowered personempowered transcend limitations third dimension thirddimensional thinking institutions wanted people become empowered benefited people separation power people obedience placing position power part thirddimensional legacy part beings learning learning transcend grow beyond experience coming earth part spiritual path explore sexuality part spiritual path go beyond limitations thinking says sexuality shameful sinful go beyond limited kind belief structure point view ways right course experience limited taken belief systems probably natural understandable thing encountered child likely ones trusting discern beliefs supportive believed took believed adult growing maturing spiritually become aware conscious choose believe choose follow ideas choose empower seem true sense consistent experience guidance guessing longer ascribe beliefs sexuality masturbation inherently wrong bad sinful yet struggling earlier programming right questioner correct mary magdalene kind conversation immensely helpful understanding option amongst options point view probably sensitive child awareness energy probably high naturally aware sexual energy young age possibly younger people empowering explore wonderful point view certainly harm aware come child exploring sexuality masturbating orgasms programming individualsvery likely including family members uncomfortable conflict beliefs level shame carried comfort around sexuality altogether programming received ascribed fact problem probably part told wrong maybe tell maybe experiencing within sensitive picked discomfort conflict beliefs took seem accurate questioner exactly seems mary magdalene part realize really issues difficulty challenges took simply natural sensitive self important realize decision issues issues choice course young natural young nevertheless choice choice longer continue beliefs conflicts others carrying sense questioner yes absolutely mary magdalene mean need go telling everyone meet feel differently different point view supportive choice share certainly relationship arenas relative sexuality relative use medicine taking shown strongly whenever makes choice always wonderful say beautiful reasons choice reasons called inner divine qualities made choice medicine later prescribed important reasons made choice mean outcome choice outcome behaviors chose engage ones pleased look outcome behaviors regret choice regret chose act upon motivations particular regret shame different regret part human experience humans makes choices retrospect choices happy choices happy serve growth fine choices happy part growth process realize made choices happy humans experience regret given program whenever feel regret means bad person likely regret turn shame shame saying something defective made choice took action based combination regret judgment making judgments known better stronger vulnerable kind artificial support making kinds judgments questioner yes mary magdalene judgments making questioner tends done stronger emotional mary magdalene know better stable people problems kinds questioner absolutely mary magdalene yes something matter right questioner exactly mary magdalene set judgments aside able feel something different terms emotion shame relative taking medicine questioner yes mary magdalene comes questioner compassion mary magdalene perhaps regret sadness situation questioner yes sadness regret especially talking inner divine qualities feel compassion mary magdalene yes sadness engaging medicines supported hoping true questioner correct mary magdalene negative ramifications right questioner yes mary magdalene yes look inner divine qualities hoping fulfill taking medicine taking prescribed hoping accomplish consciously unconsciously questioner power myselfbeing powerful productive getting stuff done able connect people used medicine mask depression well wanted joyful happy connect people give joy happiness people mary magdalene beautiful important thing help shame realize valid important beautiful reasons making choices wanted power wanted productive functional wanted connect others wanted joy life wonderful important everyone needs life choosing modality trying accomplish perhaps work hoping mean bad person simply means made choice work hoping steps different choice steps substance choose whatever seems wisest choice accomplish still important feel empowered functional productive connect others joy life still need simply shift selfjudgment paralyzing position bad tried something work hoped going look fulfill important inner divine qualities land questioner helpful feels healing mary magdalene wonderful hopefully finding people support finding practical steps fulfill inner divine qualities support better ways ways trying medicine highly recommend change languaging rather saying substanceabuse problem because labeling involved abusesay problem use medication supporting want change simply state without judgment feel difference questioner absolutely yes laughing thank feels better mary magdalene laughing wonderful questioner another question depression big fear depression anticipate depression result chemical changes going body going medication started use medication mask depression really fatigue lack motivation mary magdalene yes wonderful getting root issues motivated originally use medication look options need medication help depression look using medication option look medications helpful choose engage medication find someone help full spectrum concerns want work someone naturally oriented open use medications option help sort various possibilities well concerns help come holistic program tailored hopefully help best help monitor program working start medication find working hoped consequences realize beforehand choices steps start look natural options handling depression diet change actual biochemistry body exercise certain social engagements support group sort working therapist coach kinds suggest support person coming trust feel understanding full picture help access different kinds resources need questioner thank helpful mary magdalene wonderful <NUM> mercedes kirkel <URL> rights reserved permission given share message long message posted entirety nothing changed altered mercedes kirkel credit authorship copyright notice mercedes kirkel website <URL> included receive messages mercedes kirkel # <NUM> bestselling multiawardwinning author bringing forth messages instruction mary magdalene beings light book mary magdalene beckons join river love available wwwmarymagdalenebeckonscom mercedes latest book sublime union woman sexual odyssey guided mary magdalene available wwwsublimeunioncom messages practices universal affiliated religion receive ongoing messages mary magdalene beings light mercedes go wwwmercedeskirkelcom request added mailing list mercedes offers workshops private sessions san francisco bay area ca including guidance mary magdalene beings light heartsource life relationships coaching lightfilled intimacy instruction spiritual mentoring available inperson long distance phone skype travel location information go wwwmercedeskirkelcom note mercedes feel served mary magdalene messages donation support posting messages greatly appreciate click button thanks receive book messages mary magdalene sublime union woman sexual odyssey guided mary magdalene sacred sexuality manual erotic memoir copyright <NUM> mercedes kirkel <URL> rights reserved please copy share article long shared entirety including copyright notice information altered excerpted added credit authorship website address wwwmercedeskirkelcom included money exchanged uses please contact mercedes kirkel wwwmercedeskirkelcom obtain permission thank source <URL> sexuality/,2018-01-25 16:17:44.789555,2018-02-02 01:19:41.756632,2018-02-02 01:19:41.756664,MARY MAGDALENE: Healing Shame Around Addictions and Sexuality,Mercedes Kirkel,,[''],,,
