Unnamed: 0.1,Unnamed: 0,id,domain,type,url,content,scraped_at,inserted_at,updated_at,title,authors,keywords,meta_keywords,meta_description,tags,summary
91,91,15468,beforeitsnews.com,fake,http://beforeitsnews.com/science-and-technology/2017/09/yawning-why-is-it-so-contagious-and-why-should-it-matter-2901347.html,headline bitcoin blockchain searches exceed trump blockchain stocks feeling tired tired yawn someone experts university nottingham published research suggests human propensity contagious yawning triggered automatically primitive reflexes primary motor cortex area brain responsible motor function study neural basis contagious yawning published academic journal current biology another stage research underlying biology neuropsychiatric disorders search new methods treatment latest findings show ability resist yawning someone nearyawns limited urge yawn increased instructed resist yawning matter hard try stifle yawn might change yawn alter propensity yawn importantly discovered urge yawn propensity contagious yawning individual ofstephen jackson professor cognitive neuroscience school psychology led multidisciplinary study suggest findings particularly important understanding association motor excitability occurrence echophenomena wide range clinical conditions linked increased cortical excitability / decreased physiological inhibition epilepsy dementia autism tourette syndrome echophenomena human trait contagious yawning triggered involuntarily observe another person yawn common form echophenomena automatic imitation another words echolalia actions echopraxia humans propensity contagious yawning chimpanzees dogs credit steve evans wikimedia commonsechophenomena seen wide range clinical conditions linked increased cortical excitability / decreased physiological inhibition epilespsy dementia autism tourette syndrome neural basis contagious yawning neural basis echophenomena unknown test link motor excitability neural basis contagious yawning nottingham research team used transcranial magnetic stimulation tms recruited <NUM> adults help study volunteers viewed video clips showing someone yawning instructed either resist yawning allow yawn,2018-01-25 16:17:44.789555,2018-02-02 01:19:41.756632,2018-02-02 01:19:41.756664,Yawning — Why Is It So Contagious and Why Should It Matter?,Alton Parrish,,[''],,,
189,189,29553,beforeitsnews.com,fake,http://beforeitsnews.com/spirit/2014/06/reviving-rivers-reviving-life-2487364.html,reviving rivers reviving life headline bitcoin blockchain searches exceed trump blockchain stocks february <NUM> small group volunteers art living took project revive kumudavati river outskirts bangalore dry four decades pleased inform lok adalat karnataka high court recognized good work source <URL>,2018-01-25 16:17:44.789555,2018-02-02 01:19:41.756632,2018-02-02 01:19:41.756664,"Reviving rivers, Reviving life",Wisdom Blog Of Art Of Living,,[''],,,
112,112,19547,beforeitsnews.com,fake,http://beforeitsnews.com/alternative/2016/04/attn-phone-security-101-for-copblockers-3342544.html,attn phone security <NUM> copblockers headline bitcoin blockchain searches exceed trump blockchain stocks post written joseph tye tx copblock posted various alternative media outlets great tips anyone certainly copblocker tye additional features detailed future questions concerns suggestions please comment thing notice activists protesters total lack digital security ofcarry around computer pocket allowsto amazing recording high definition videos taking photos accessing amazing collection data human race ever amassed yet despite capabilities amazing device actually understand device capable basic guide written average user gloss drastically oversimplify technical aspects others sake simplicity every use computer kind certain security precautions must taken order ensure personal safety steal data state wish either claim violated illegitimate rules simply frame basic security measures inexpensive often free easy enough less technical users click banner connect copblock group near recommendation always fully encrypt device recent fbi vs apple court case showed simple step enough put thorn side huge state agency practically limitless resources encryption data useless without correct passphrase recent iphones anything iphone 3gs encrypted default android devices however simple process step step guides every device available easily accessed simple online search devices running recent version android operating system encrypted going settings > tab > security sure phone fully charged attempting given option always choose fully encrypt external memory phone people love option using fingerprint decrypt phone consider highly secure however please account courts ruled right selfincrimination enumerated fifth amendment giving passphrase order decrypt phone right giving finger print arrested activism highly likely mobile device seized unless wish actors state access everything photos videos persons committing civil disobedience personal photos data access social media etc something wish account impossible state agents plant suicide notes evidence something access passcode phone mean accessed must encrypted ========= multiauthor adsense ========= skipped due <NUM> adsense ads page already ======================================== copblock information tips tactics gear graphics click graphic security precautions include turning wifi bluetooth actively using features provide others access phone wantthe second recommendation good antivirus program call cell phone mobile computer phone capabilities afford paid program available free recommend bitdefender however personally use kaspersky internet security android found among best available feature set particularly useful involved activism including ability remotely lock phone remotely wipe phone data must legal disclaimer jurisdictions aware illegal tamper evidence wiping data phone taken state agents wish case use features discretion personally option available remember people seek exploit information employees state wish use internet anonymously mobile device prevent others able electronically gather passphrases used internet browsing unsecure wifi hotspot virtual private networkvpn must paid vpn services cheap fast easy use arguably best available private internet access bought anonymously internet downloaded total five devices service provides secure connection device mobile device home personal computer thirty servers worldwide data read reaches end server decrypted prevents people able intercept data wifi used mask true location encryption protocols offered company private internet access best available considered yet unbreakable free options available difficult beginner tend far restricted bandwidth slow attn phone security <NUM> copblockers post cop block badges grant extra rights source <URL> copblockers/,2018-01-25 16:17:44.789555,2018-02-02 01:19:41.756632,2018-02-02 01:19:41.756664,ATTN: Phone Security 101 for CopBlockers,Cop Block,,[''],,,
59,59,10186,washingtonexaminer.com,political,http://www.washingtonexaminer.com/justice-department-asks-supreme-court-to-overturn-daca-ruling/article/2646397,department justice thursday formally asked thesupreme court overturn lower court ruling block part trump administration decision phase deferred action childhood arrivals program unusual step bypasses the9th circuit court appeals normal move overturndistrict judge william alsup ruling last week san franciscobased judge ordered trump administration renew parts daca start accepting renewal applications already part program related lawsuits legal system however alsup demand new applications accepted tuesday attorney general jeff sessions alsup ruling defies law common sense department supreme court request happen week end daca impacts roughly <NUM> people dubbed dreamers set expire march <NUM> sessions announced september trump administration rescinding obamaera program congress tasked passing legislation keep dreamers defined people entered country minors risk deportation,2018-01-25 16:17:44.789555,2018-02-02 01:19:41.756632,2018-02-02 01:19:41.756664,Justice Department asks Supreme Court to overturn DACA ruling,Kelly Cohen,,"['Dream Act', 'Law', 'Justice Department', 'Kelly Cohen', 'Jeff Sessions', 'Supreme Court', 'Immigration', 'News', 'Politics']","The unusual step bypasses the U.S. 9th Circuit Court of Appeals, which would have been the normal move to overturn U.S. District Judge Willi...",,
21,21,3009,awarenessact.com,conspiracy,http://awarenessact.com/6-ways-to-handle-a-psychic-attack/,ever felt place apparent reason nothing seemed going right mean psychically attacked need know combat negative thoughts psychic attacks pushed onto need something stop happening keep controlling life come others often unintentional someone jealous put world power realize find list help situations arise <NUM> feel psychic attacks heading pretty popular practice meditation imagine white light solar plexus chakra point allow expand ever gently breath grow brighter expands beyond borders body begin notice difference means clearing away negative feelings attacking body known smudging suggest using white sage easily accessible job cleanse person home rid negativity lingering research figure crystals work best specifically black tourmaline works wonders carry pocket every single day swing carrying crystals notice big change <NUM> enforce healthy boundaries find attacks coming specific person limit presence life able hold power bringing cutting essential <NUM> clear longer affected tell verbally longer let attacks bother affect life setting intentions making clear broken mentioned put world hold power realize <NUM> meditate often strengthen aura meditate clear mind really work bring deeper sense strength aura easier sounds,2018-01-25 16:17:44.789555,2018-02-02 01:19:41.756632,2018-02-02 01:19:41.756664,6 Ways to Handle a Psychic Attack,Gerald Sinclair,,[''],,"energies, negative thoughts, protection, psychic, things, interesting, thoughts, psychic attacks, interest, manifesting, negative energies, steps",
130,130,21470,beforeitsnews.com,fake,http://beforeitsnews.com/strange/2015/10/nick-redfern-on-david-marlers-ufo-treasure-trove-2462062.html,easily understand difference day christ day lord end times,2018-01-25 16:17:44.789555,2018-02-02 01:19:41.756632,2018-02-02 01:19:41.756664,Nick Redfern on David Marler's UFO treasure trove,Ufo Iconoclast,,[''],,,
125,125,21093,beforeitsnews.com,fake,http://beforeitsnews.com/family-parenting/2014/08/sex-education-may-begin-for-7-year-olds-in-the-uk-too-young-2447994.html,sex education begin <NUM>yearolds uk young headline bitcoin blockchain searches exceed trump blockchain stocks liberal democrat party great britain proposing age appropriate sex education classes introduced include internet porn social media students young seven old young question initial sex education conversation begin parents educational system parents exactly thrilled idea talk child comes sexual education although know must happen question always stds quickly spreading throughout today youth children need taught safe sexual relations order informed decisions problem parents shy away topic late irresponsibly leave educational system handle difficult conversation,2018-01-25 16:17:44.789555,2018-02-02 01:19:41.756632,2018-02-02 01:19:41.756664,Sex Education May Begin for 7-Year-Olds in the UK – Too Young?,,,[''],,,
138,138,22541,beforeitsnews.com,fake,http://beforeitsnews.com/financial-markets/2018/01/what-if-workplace-distractions-were-considered-part-of-consumption-instead-of-part-production-2950252.html,workplace distractions considered part consumption instead part production headline bitcoin blockchain searches exceed trump blockchain stocks sir tim harford blocked twitter writes bank england unofficial blogcompared plunging productivity soaring shipments smartphones typical productivity growth advanced economies hovered steadily around <NUM> per cent year several decades average negative since <NUM> year iphone started ship computers making generalists ofall december <NUM> iphone close distant cousins cause lot distractions distracted classified production consumption outputs remain fairly point higher productivity higher real salaries ps harford writes lot power point presentations long ago perkurowski source <URL> workplacedistractionswerehtml,2018-01-25 16:17:44.789555,2018-02-02 01:19:41.756632,2018-02-02 01:19:41.756664,What if workplace distractions were considered part of consumption instead of part production?,Tea With Ft,,[''],,,
128,128,21203,beforeitsnews.com,fake,http://beforeitsnews.com/celebrities/2014/07/beyonce-validates-cheating-rumors-2465534.html,beyonc validates cheating rumors headline bitcoin blockchain searches exceed trump blockchain stocks beyonc confirm fans jay z cheated ohio stint run tour check video signs lead yes unlike average press release celebrities release trouble paradise beyonc took stage rumors flying around internet several weeks alleging jay z cheated wife suggested jay bey dreading run tour cancelling option decided put business usual faces jobs someone close jay z given beyonc unlimited access emails text messages hopes calming situation keeping peace tell enough keep queen side,2018-01-25 16:17:44.789555,2018-02-02 01:19:41.756632,2018-02-02 01:19:41.756664,Beyoncé Validates Cheating Rumors,,,[''],,,
203,203,33458,beforeitsnews.com,fake,http://beforeitsnews.com/opinion-conservative/2018/01/trump-arrives-in-davos-3357452.html,trump arrives davos readers story fact add cents headline bitcoin blockchain searches exceed trump blockchain stocks hey feminists behold alpha male needs slot machines rush amazon lightning deals seriously spend hours perusing lightning deals wisely either figure best deals pages receive small commission purchase item links additional cost thank source <URL>,2018-01-25 20:13:50.426130,2018-02-02 01:19:41.756632,2018-02-02 01:19:41.756664,Trump arrives in Davos…,"Adrienne, 'S Corner",,[''],,,
167,167,26150,washingtonsblog.com,bias,http://www.washingtonsblog.com/2012/08/because-i-was-silent-when-they-came-for-others-when-they-came-for-me-there-was-no-one-left-to-speak-out.html,silent came left help came tortured acitizen gang member remained silent criminal tortured acitizen whistleblower navy veteran remained silent whistleblower locked attorney representing accused criminals remained silent defense attorney arrested young father walking son simply told dick cheney disagreed policies remained silent never talked important politician entertainer killed questioned government version important historical event remained silent entertainer arrested people demanding congress hold president constitution speak never protested washington arrested man holding sign held tongue never held kind sign broke minister leg wanted speak public event nothing religious leader shot student taser gun arrested asking question politician public event remained silent student started labeling virtually every innocent normal behavior marking americans potential terrorists remained silent want called terrorist threw political dissenters psychiatric wards remained silent want seen crazy declared labelcitizens living onsoil unlawful enemy combatants imprison indefinitely without access attorney remained silent want labeled enemy declared assassinatecitizens living onsoil without due process law remained silent want list came everyone silent left speak inspired poem came martin niemller written nazis originally wrote poem <NUM> updated additional verses current events unfolded,2018-01-25 16:17:44.789555,2018-02-02 01:19:41.756632,2018-02-02 01:19:41.756664,I Will Stand Up For You If You Stand Up For Me,"Posted On, Sam Oconnel, President Ron Paul",,[''],,Podcasts from Boiling Frogs,
155,155,24398,beforeitsnews.com,fake,http://beforeitsnews.com/entertainment/2015/06/insider-exposes-hollywoods-satanic-underside-2535696.html,insider exposes hollywood satanic underside readers story fact add cents headline bitcoin blockchain searches exceed trump blockchain stocks insider exposes hollywood satanic underside <NUM> <NUM> cautioningto never idolize star insider says successful actors stars celebs heavily compromised order achieve dream clones stars replaced revealing exposes hollywood depravity great hollywood illuminati elite play central role inducting society cabalist satanic cult go behold sending sheep among wolves luke <NUM> <NUM> sasha spencer henrymakowcom sept <NUM> <NUM> know hollywood perverse insider posted new information beyond pale confirms everything encountered flitted along margins show business 1980s including human cloning child sacrifice film sets sexually highly charged encounters showbiz strangeness ran usual gamut offers sleep play producers power players group sex upon cast lead play fairly large city really helped along realized needed live sleep octogenarian director duration theater run declined part finding cast member girlfriend really shemale famous countrywestern singer likes used human toilet going back stage meet danny thomas star room daddy performance grabbed rammed tongue throat price show biz realities industry insider blood line types film school call made career launched shirley maclaine warren beatty might example people come multigenerational abuse families helps jewish nobodies eventually come across pay play scenario basically prostitution sleeping producers directors call escort say career goes nowhere according author darwin porter stars including james dean rock hudson marilyn monroe lucille ball started careers prostitutes hoover tolson sexual secrets america famous men women <NUM> never heard author expose shared moniker right brain creative types idealistic naive world savedboth long run grooming stage order reach higher echelons entertainment family tribe connections must work drug use/sexual permissiveness/prostitution/escort stages mind control handlers darker levels spiritual possession soulloss profound level sets stage performer become part dark world artists resist huge threat controllers compromise evidence perversions threaten finally kill big moneymaker often replaced mean another actor <NUM> version keep making money dark side talking losing soul people real cloned cloning around decades kept dark former entertainer stories relay famous celebrities changed character looks suspicion replaced names stars michael jackson ann margaret joan baez jane fonda jennifer connolly friends industry knew entertainers personally believed indeed replaced mentions bob dylan recently saw interview dylan <NUM> minutes admitted camera indeed made deal devil long ago bob look happy replacement confusing detect stars plastic surgery horrific results basic mutilation mickey rourke priscilla presley cases extreme surgeries used form torture fall line actor /performer replaced surgery takes place cloning improve original clones never live originals deteriorate rapidly subtle differences however actors anything bodies minds work hollywood damaged people cautioningto never idolize star insider says successful actors stars celebs heavily compromised order achieve dream mean show business distraction ancient rome poet juvenal describing political power scene day panem et circenses bread circuses meaning keep masses fed entertained less likely kill notice invisible handlers boils elite demonic force behind spoke madonnas groom younger women eventually place sexual/psychic rituals women mind controlled abused insider states celeb charity boards fronts prostitution sex trafficking drugs celebs set boyfriends marriages arranged actresses agree porn exchange perks rich man knowing lose break guy human sacrifice snuff films human sacrifices films done sex slave/prostitute/call boy gotten slightly haggard past sell date pissed wrong people huge market satanic sacrifice films among exclusive connected wealthy circles ie demonic illuminati touches pregnant actresses suddenly pregnant babies used human sacrifice claims bristol palin pregnant four times three babies disappeared suddenly pregnant read actress believes long list famous people sacrificed child including political figures mysterious accidents happened big name people thereafter magically career takes know saying comes whereby signing contract people joke giving born child example george bush sr little girls died ever heard remember barbara bush keeping fetus jar attest phenomenon suspicious shortly beautiful young mother killed horrific accident weeks death invited washington dc asenator father financial campaign manager went home george bush sr party holding poppy hand chatting barbara remember total complete shock profoundly disassociated body afterward soon presidential visit father career took gangbusters soon oodles money family jet flying jet henry kissinger among elites pretty suspicious ask sacrifice know makes want go hmm mmmmmammon kansas informant ran dark arts early dark arts ruled illuminati/reptilian/negative et negative humans/military industrial complex negative gatekeepers need certain number true artists light worker types camouflage sometimes light types targeted move higher level playing field surrounded relatively nice handlers corrupt conclusion point everyone industry decision yield corruption late human batteries pilfer higher energy drugs alcohol spiritual possession easier choice actor/performer compromise anything job evil really steps people keep drugging drinking harrowing dark choice ok keep illusion want point protest tell truth really going onthey often replaced become surrounded dark people dark organizations dark nonhumans et hybrids happens barely control happens victims satanic industry family ties speak lives easier erase dispose planned design conclusion people especially west allowed hollywood hype distort sense reality none accident carefully planned world held hostage illusion run satanic cult classic faustian deal devil real <URL> contract made entertainment industry allows something horrible possess individual spiritually physically emotionally sexually entire consumed dark energy personal free extinguished artists deal ever works well honor among thieves this<URL> insideractress says saved light intrinsically knew stay away positively know light inner knowing kept safe ofcitizens 3d earthly plane rightfully meant need stop complicit destruction continuing wake need grasp fundamentals reality say false illusion preyed upon preternatural force deals grandest illusions pushes forth great work ages look hope escape evil/dark reality shed reptilian scales eyes disengage lie stop feeding beast related speaking possessed peoplecheck <URL> say sarah jessica looking bit reptilian endorsing someone downlow club secret society le boule <URL> # sthashd2ktqko7dpuf,2018-01-25 16:17:44.789555,2018-02-02 01:19:41.756632,2018-02-02 01:19:41.756664,Insider Exposes Hollywood’s Satanic Underside,James Rathey,,[''],,,
