Unnamed: 0.1,Unnamed: 0,id,domain,type,url,content,scraped_at,inserted_at,updated_at,title,authors,keywords,meta_keywords,meta_description,tags,summary
118,118,20034,beforeitsnews.com,fake,http://beforeitsnews.com/economy/2016/04/are-negative-interest-rates-ineffective-2-2813489.html,negative interest rates ineffective headline bitcoin blockchain searches exceed trump blockchain stocks piece originally produced posted mni news european central bank initially received praise decision push deposit rate zero part truly unconventional monetary policy euro plunged equities recovered euro area manufacturing outperformed global peers holders longterm benchmark bonds handsomely rewarded ecb monetary policy experiment <NUM>year yields germany resumed violent decline investors expect judged decline shortterm yields indicating interestrate cut march least <NUM> percentage point equity investors banking sector voting feet partly due fears new rules allowing regulators bail creditors equity holders angst already beleaguered eurozone financial institutions suffer slings arrows disappearing net interestrate margins adding insult injury currency markets challenged central banks use negative interest rates global growth fears led unwinding euro yenfunded carry trades pushing value currencies bank japan attempt curb investor interest currency lowering deposit rate zero far match upward pressure yen risk sentiment eventually recover traders inclination use euro yen funding currencies difficult deny cornerstones post<NUM> monetary policy tools suffered severe blow large central bank ecb enjoy mover advantage push interest rates zero major central banks follow diminishing returns set disadvantages begin outweigh advantages potential downsides negative interest rates hotly contested point least clear examples euro area banks return equity net margins recovered somewhat following sovereign debt crisis <NUM> downside risks looming based persistent decline interest rates based historical relationship return equity longterm bond yields investors currently face negative returns eurozone bank equities money market industry another victim low interest rates assets management money market funds resilient despite low interest rates likely result qe surging ecb demand government securities means tax negative interest rates lower money market funds government bonds funds business model sense negative interest rates estimate eligible assets eurozone money market funds trade yields zero customers willing pay access liquidity extent money market funds survive interest rate regime ever fundamental critique levied negative interest policy leads behavior opposite central banks want portfolio rebalancing theory suggests lowering benchmark yield via quantitative easing qe zero interest rate policy zirp pushes investors move funds risk spectrum idea encourage money managers wealth holders lend capital riskier productive projects certainly seen tremendous search yield markets asset classes deeply negative interest rates perverse effects plunging bond yields erode returns safe relatively liquid part investors portfolios expose investors volatility core fixed income holdings used yields suddenly spike higher curb desire seek higher returns equity credit markets opposite central banks sought achieve unconventional policies finally negative interest rates send signal economy dire need emergency support push consumer business confidence lower signals growth remain low weak extended period markets questioning negative interestrate policies suggests tactically savvy ecb rethink strategy specifically central bank choose keep deposit rate unchanged month compensate largerthanexpected extension increase qe doubt choose route deemphasizing negative interest rates policy tool send euro higher dampening inflation expectations negative interest rates imperfect tool bet key central banks continue deploy long global disinflationary headwinds remain source <URL>,2018-01-25 16:17:44.789555,2018-02-02 01:19:41.756632,2018-02-02 01:19:41.756664,Are Negative Interest Rates Ineffective?,Alpha Sources,,[''],,,
194,194,29985,naturalnews.com,junksci,https://www.naturalnews.com/health_food_products.html,recommended resources counterthink cartoons free view download cover topics health environment freedom consumer wellness center nonprofit organization offering nutrition education grants programs help children expectant mothers around world food investigations series minidocumentaries exposing truth dangerous ingredients food supply webseedcom offers alternative health programs documentaries honest food guide free downloadable public health nutrition chart dares tell truth foods really eating healingfoodreferencecom offers free online reference database healing foods phytonutrients plantbased medicines prevent treat diseases health conditions herbreferencecom free online reference library lists medicinal herbs health benefits nutrientreferencecom free online reference database phytonutrients natural medicines found foods health benefits lists diseases foods herbs,2018-01-25 16:17:44.789555,2018-02-02 01:19:41.756632,2018-02-02 01:19:41.756664,"Health food products news, articles and information:",,,['Health food products'],"Health food products news, articles and information:",,
96,96,15920,beforeitsnews.com,fake,http://beforeitsnews.com/libertarian/2014/10/smart-things-you-could-say-about-ray-rice-and-isis-2582014.html,smart say ray rice isis readers story fact add cents headline bitcoin blockchain searches exceed trump blockchain stocks zero aggression project gives heuristics starting homepage website reading headlines mental tools can help escape conventional thinking give amazing insight sound smartest person room zero aggression project cocreators jim babka perry willis applying heuristics today current news stories say beheading videos perry willis friends insist must something isis beheading videos say powerful set answers read piece comment share following places facebook link <URL> google+ link <URL> blog link <URL> say ray rice video roger goodell nervous electoral campaign oust jim babka everyone talking video showing running back ray rice knockingout wife casino elevator calls nfl commissioner roger goodell lose job libertarian teaching moment available story something special say friends read piece comment share following places facebook link <URL> google+ link <URL> blog link <URL> ideas matter actions powerful zero aggression principle influential join conversation spread word start conversation sharing information thank source <URL> sayaboutrayrice isis,2018-01-25 16:17:44.789555,2018-02-02 01:19:41.756632,2018-02-02 01:19:41.756664,Smart Things You Could Say About Ray Rice and ISIS,Downsize Dc,,[''],,,
8,8,1411,beforeitsnews.com,fake,http://beforeitsnews.com/economy/2018/01/usa-dollar-tanks-on-mnuchin-statement-that-he-wants-a-lower-dollar-value-2931673.html,usa dollar tanks mnuchin statement wants lower dollar value headline bitcoin blockchain searches exceed trump blockchain stocks harvey organ harvey organ blog usa index breaks <NUM> ends <NUM>/usa <NUM> yr bond note <NUM>/gold rises <NUM> <NUM>/silver rises <NUM> cents <NUM> breaks huge <NUM> resistance/monstrous issue gold efps <NUM>/huge silver efp issuance <NUM> contracts/huge <NUM> tonnes gold added gld/nothing added slv/huge number swamp stories tonight gold <NUM> <NUM> silver <NUM> <NUM> cents closing access prices gold <NUM> silver <NUM> shanghai gold fix fix <NUM> <NUM> pm est <NUM> shanghai local second fix <NUM> est <NUM> shanghai local shanghai gold fix <NUM> dollars per oz ny price gold exact <NUM> premium fix <NUM> xxxxxxxxxxxxxxxxxxxxxxxxxxxxxxxxxxxxxxxxxxxxxx second shanghai gold fix <NUM> ny gold price exact <NUM> premium shanghai 2nd fix/ny1546 shanghai rejects ny /london pricing gold xxxxxxxxxxxxxxxxxxxxxxxxxxxxxxxxxxxxxxxxxxxxxxxxxxx london gold fix <NUM> est <NUM> ny pricing exact <NUM> london second gold fix <NUM> <NUM> ny pricing exact <NUM> comex gold january/ number notices filed today january contract <NUM> notices <NUM> oz total notices far <NUM> <NUM> oz <NUM> tonnes silver january <NUM> notices filed today for50000 oz/ total number notices filed far month <NUM> <NUM> oz xxxxxxxxxxxxxxxxxxxxxxxxxxxxxx bitcoin bid <NUM>/offer <NUM> <NUM> morning bitcoin bid <NUM>/offer <NUM> <NUM> closing/<NUM> pm end lethave look data today xxxxxxxxxxxxxxxxxxxxxxxxxxxxxxxxxxxxxxxxxxxxxxxxxxxxxxxxxxxxxxxxxxxxxxxxxx silver total open interest fell tiny <NUM> contracts <NUM> falling <NUM> yesterday <NUM> cent loss silver pricing thus minimal comex liquidation however notified another huge sized number comex longs transferring contracts london efp route <NUM> efp march zero months thus total issuance <NUM> contracts however movement across london severe gold seems major players willing banks comex still transfer <NUM> contracts cme stating silver gold delivered upon comex must export obligation london keep mind delay <NUM> hrs issuing efp accumulation efp s/silver/ starting day notice/ month january <NUM> contracts <NUM> trading days total <NUM> contracts <NUM> million oz average per day <NUM> contracts <NUM> million oz/day give idea huge supply month silver far month <NUM> million paper oz morphed london represents around <NUM> annual global production result tiny sized loss oi comex despite <NUM> cent loss silver price usually indicates another failed banker shortcovering huge sized efp issuance <NUM> contracts exited silver comex transferred oi london forwards speculators continued interest attacking silver comex physical silver cme data <NUM> efp issued today deliverable forward contract london fiat bonus really gained <NUM> oi contracts ie <NUM> open interest contracts headed london efp together decrease <NUM> oi comex contracts happened fall price silver <NUM> cents closing price <NUM> respect yesterday trading yet still good amount silver standing comex ounces comex oi still represented <NUM> billion oz ie <NUM> billion exact <NUM> annual global silver production ex russia ex china new front january month/ filed <NUM> notices <NUM> oz silver gold open interest surprisingly rose considerable <NUM> contracts to582421 good sized rise price gold yesterday trading <NUM> another huge development received total number gold efp issued wednesday totaled humongous sized <NUM> contracts february saw <NUM> contracts issued april saw issuance <NUM> contracts new oi gold complex rests <NUM> remember delay issuance efp bankers remove long positions comex gold immediately orchestrate private efp deal longs additional <NUM> hrs generally match respect departing comex longs new efp long transfers demand gold intensifies greatly continue witness huge number efp transfers together massive increase gold comex oi together total amount gold ounces standing january comex though bankers issued monstrous efps obligation still rests bankers supply metal transfers risk london banker obligation new york comex obligation longs receive fiat bonus together long london forward thus actions bankers comex stated appreciable metal massive fraud supply metal comex longs quite willing supply massive non backed gold silver paper knowing metal satisfy longs london severely backward gold silver big rise gofo sifo witnessing delays actual deliveries essence today huge gain <NUM> contracts <NUM> oi contracts increased comex good sized <NUM> oi contracts navigated london expect huge numbers efp issued approach day notice gold feb comex contract wednesday jan <NUM> yesterday <NUM> efp issued accumulation efp s/ goldexchange physical month january starting day notice <NUM> contracts <NUM> million oz <NUM> tonnes17 trading days thus averaging <NUM> efp contracts per trading day <NUM> oz/day give idea huge size efp transfers far month <NUM> trading days tonnes <NUM> tonnes total annual gold production <NUM> throughout world ex china ex russia <NUM> tonnes thus efp transfers represents <NUM>/<NUM> tonnes = <NUM> global annual production far january alone result shockingly strong sized increase oi comex fair sized rise price gold trading yesterday <NUM> another gigantic sized number comex long transferring london efp route <NUM> obviously seem physical gold comex yet observed huge delivery month month december guess explains huge issuance efp sthere hardly gold present gold comex delivery purposes account <NUM> efp contracts issued net gain open interest <NUM> contracts exchanges <NUM> contracts move london <NUM> contracts increased comex tonnes gain total oi equates <NUM> tonnes <NUM> notices filed upon <NUM> oz gold xxxxxxxxxxxxxxxxxxxxxxxxxxxxxxxxxxxxxxxxxxxxxxxxxxxxxxxxxxx respect criminal funds gld slv gld gold <NUM> huge change gold inventory gld/ deposit <NUM> tonnes inventory rests tonight <NUM> tonnes slv/ big changes silver inventory slv/ huge withdrawal <NUM> million oz slv inventory/ inventory rests <NUM> million oz/ end outline discussed tonight <NUM> today open interest silver fell tiny <NUM> contracts <NUM> <NUM> little new comex record set friday/april <NUM>/<NUM> <NUM> fall price silver tune <NUM> cents respect yesterday trading bankers used emergency procedure issue another good <NUM> private efp march look contracts private cftc audit <NUM> efp months efp give comex longs fiat bonus plus deliverable product london zero comex silver comex liquidation oi loss comex <NUM> contractsto <NUM> oi transferred london efp obtain big gain <NUM> open interest contracts still good amount silver ounces standing metal january net gain today oz exchanges <NUM> million oz result small sized decrease silver oi comex despite tiny fall <NUM> cents price respect yesterday trading another strong <NUM> efp issued transferring comex longs london together good sized amount silver ounces standing january demand physical silver intensifies witness major bank short covering accompanied increases gofo sifo rates indicating scarcity report harvey 2a shanghai london gold fix report harvey <NUM> b gold/silver trading overnight europe goldcore mark byrne/zerohedge ny bloomberg <NUM> asian affairs ilate tuesday night/wednesday morning shanghai closed <NUM> points <NUM> /hang sang closed <NUM> pts <NUM> / nikkei closed <NUM> points <NUM>/australia ordinaires closed <NUM>/chinese yuan onshore closed well <NUM>/oil <NUM> dollars per barrel wti <NUM> brent stocks europe opened red onshore yuan closed dollar <NUM> offshore yuan closed onshore yuan <NUM>//onshore yuan stronger dollar/off shore stronger dollar/ dollar index weaker major currencies china happy todaygood markets/weaker usa dollar read harveyorganblogcom source <URL> hewants lowerdollarvalue,2018-01-25 16:17:44.789555,2018-02-02 01:19:41.756632,2018-02-02 01:19:41.756664,Usa Dollar Tanks On Mnuchin Statement That He Wants A Lower Dollar Value,,,[''],,,
227,227,37119,beforeitsnews.com,fake,http://beforeitsnews.com/alternative/2018/01/benjamin-fulford-tensions-rise-between-bloodlines-and-illuminati-as-final-showdown-looms-for-u-s-corporate-government-15-january-2018-3588243.html,something goingon ofhave speculated help qanon +videos,2018-01-25 20:13:50.426130,2018-02-02 01:19:41.756632,2018-02-02 01:19:41.756664,Benjamin Fulford: Tensions Rise Between Bloodlines and Illuminati as Final Showdown Looms for U.S. Corporate Government – 15 January 2018,James Rathey,,[''],,,
213,213,35136,beforeitsnews.com,fake,http://beforeitsnews.com/gold-and-precious-metals/2017/12/2018-inflation-concerns-see-gold-price-rally-before-fed-rate-rise-3176604.html,gold prices rallied <NUM> per ounce yesterday fresh <NUM>month lows dollar asian trade wednesday lose half bounce london traders looked today keymonetary policy decision federal reserve withinflation data due later wednesday thefed widelyexpected quarterpoint hike interest rates new data morning put germany consumerprice index <NUM> higher november month <NUM> extended 2017s run strongest inflation germany since <NUM> gold priced dollars retreated <NUM> per ounce <NUM> tuesday low world stock markets failed follow wall street yet new all highs silver prices tested last week <NUM>month low <NUM> per ounce losing <NUM> <NUM> date versus dollar brent crude meantime rose near monday <NUM>year highs <NUM> per barrel key pipeline north sea forties oil field remained shut repairs natural gas prices europe wholesale spot market traded near <NUM>year highs outlook inflation likely remain source concern <NUM> says edward bonham carter vicechairman <NUM> billion 64bn uk asset managers jupiter question mark long wage growth remain subdued countries uk thewith labour markets tight average weekly wages uk rose <NUM> <NUM> months october new data wednesday inflation cost living rising <NUM> real wages adjusted inflation held <NUM> pence pound all peak march <NUM> major government bond prices slipped wednesday edging yield offered new buyers higher ahead fed decision <NUM>yeartreasury yields touched <NUM> per annum highest since late october betting grew fed surprise markets halfpoint hike ceiling <NUM> pricing possibility odds <NUM>in<NUM> three times likelihood implied fed funds futures market last month longterm basis shift business cycle leadsto expect commodities outperform asset classes policy makers forced hike rates says new commodities note frominvestment bank london bullion market maker goldman sachs demand backdrop today stronger year ago forecasting return nearly <NUM> commodities <NUM> <NUM> forecast october evidence mass exodus gold favor cryptocurrency bitcoin goldman sachs analysts add pointing solid investor holdings goldbacked exchangetraded trust funds currently highest since spring <NUM> saw gold sharpest price drop three decades bitcoin attracting speculative inflows goldman says calling sources demand gold investment hedge vastly different bitcoin spot prices overnight set fresh all highs <NUM> gain <NUM> last year platinum falling significantly sharply precious metals says daily commodities note german financial services group commerzbank pointing industriallyvaluable metal fresh <NUM>month lows <NUM> per ounce price differential gold widened around <NUM> biggest gap months gap gasoline autocatalyst metal palladium increased <NUM>,2018-01-25 20:13:50.426130,2018-02-02 01:19:41.756632,2018-02-02 01:19:41.756664,2018 Inflation 'Concerns' See Gold Price Rally Before Fed Rate Rise,,,[''],,,
76,76,12666,beforeitsnews.com,fake,http://beforeitsnews.com/economics-and-politics/2017/12/so-begins-the-rug-yank-phase-of-fed-policy-2501969.html,begins rugyank phase fed policy headline bitcoin blockchain searches exceed trump blockchain stocks article written mn gordon originally published economic prism / goldseek political differences today leading parties ultimate questions principles rather opposing answers question goal achieved least sacrifice lawmakers goal promise populace something nothing pretending good latest tax bill instance gop wants tax less spend democrat party wants tax spend recall seeing proposals tax less spend less shrink size state today central planners social engineers enlightened progressive know anything everything rest ofin particular share general sense know spend money better best central planners call money washington distribute back friends neighbors reality lawmakers call money washington distribute friends neighbors matter opinion matter fact coincidence top three wealthiest counties country shadow capitol dc suburbs exactly residents counties tangible value unclear however clear bogus government jobs loudoun county fairfax county virginia pay big bucks all garbage garbage eastern seaboard wall street good thing going big bankers brokers big bucks extracting capital main street america fair characterization right perhaps big bankers brokers really efficiently allocating capital highest best use knows far tell gambling people money collecting fees regardless coin tosses fall always heads win tails lose bad fugazi gig course cornerstone federal reserve call open market operations fed rigs game washington wall street favor indeed process really quite elegant smokescreen cover garbage economic data fed economists produce garbage bar charts line graphs short fabricated depictions economy growth consumer producer prices personal consumption expenditures unemployment rate whatever aggregate metrics deemed vital importance fabricated depictions serve basis fed monetary policy decisions graphs show price inflation heating cooling gdp unemployment rate going going going going federal open market committee fomc deliberates questions every six weeks fed goes work inflating nation money supply occasional rug yank stated purpose getting charts graphs illustrate garbage data liking rug yank phase fed policy outside fed economists planners appear esteemed professionals making decisions intent providing greater good country attend economic conferences forums present latest research findings abstract topics liquidity traps studies include footnotes professional economists building upon concrete knowledge base human intellect yet beneath cover bogus science real sausage made capital borrowed existence directed washington wall street dibs phony money washington wall street spend real value however real value coming fed phony money fact new phony money appears scene extracts incremental wealth workers producers across country talent labor created wealth begin moment rug yank phase fed monetary policy reel back credit ever slightly letting run wild last decade tightening credit markets effect pulling rug financial markets economy monetary policy without question exact science rudimentary guess work based committee interpretations bogus data week fomc raised federal funds rate <NUM> percent <NUM> <NUM> percent marks third increase year fifth increase cycle incidentally janet yellen delivered last press conference chair federal reserve though likely still chair fomc meeting scheduled late january jay count dracula powell helm nation central bank broad expectation powell continue rate increase playbook yellen laid includes three quarter percent hikes <NUM> wish powell best endeavors suspect unwittingly pull rug financial markets economy completes year fun really begins editor note point add article fed rug rank financial markets indeed taking place around world numerous central banks beginning coordinated fiscal tightening policy far likely international banking cabal oblivious effects actions fact likely pulling rug markets slowly deliberately full intent cause implosion massive economic bubble creating since <NUM> allowing crisis follow crisis intent benefit fully brandon smith founder altmarketcom global tensions spiking thousands americans moving ira 401k ira backed physical gold thanks littleknown irs tax law learn free info kit gold birch gold group reveals physical precious metals protect savings open gold ira click free info kit gold <URL> sobegins rugyankphase fedpolicy,2018-01-25 16:17:44.789555,2018-02-02 01:19:41.756632,2018-02-02 01:19:41.756664,So Begins the Rug-Yank Phase of Fed Policy,John Rolls,,[''],,,
60,60,10417,washingtonexaminer.com,political,http://www.washingtonexaminer.com/flyover-country-farmers-and-dc-bureaucrats-push-philadelphia-refinery-into-bankruptcy/article/2646687,crowd enveloped bus daredevils scaled greased light poles someone started lighting fireworks scene outside lincoln financial field boisterous eagles fans celebrated <NUM><NUM> victory minnesota vikings celebration needed philadelphia losing elsewhere thirty minutes game three miles away stadium workers oil refinery owned philadelphia energy solutions informed jobs jeopardy reuters reported sunday company soon file bankruptcy <NUM> employees might need start looking new line work jobs secure refinery largest oil refining complex east coast soon unemployed direct anger farmers flyover country bureaucrats washington dc refinery going broke reuters reports largely government since <NUM> philadelphia energy solutions spent <NUM> million comply renewable fuels standard forces refiners blend certain amount biofuels fuel supply purchase credits complying regulation refiner secondbiggest cost purchasing actual crude oil refine eagles head super bowl sunday february hopefully team bring back win philadelphia going need,2018-01-25 16:17:44.789555,2018-02-02 01:19:41.756632,2018-02-02 01:19:41.756664,Flyover country farmers and DC bureaucrats push Philadelphia refinery into bankruptcy,Philip Wegmann,,"['Philip Wegmann', 'Philadelphia', 'Bankruptcy', 'Ethanol', 'Energy and Environment', 'Opinion', 'Beltway Confidential']","Since 2012, Philadelphia Energy Solutions has spent $800 million to comply with the Renewable Fuels Standard.",,
